"URL","Uniprot ID","PMID","Abstract"
https://pharos.nih.gov/idg/targets/O43497,O43497,28972185,"human Cav3.1, Cav3.2, and Cav3.3 T-type channels specifically associate with CaM at helix 2 of the gating brake in the I-II linker of the channels."
https://pharos.nih.gov/idg/targets/O43497,O43497,28846697,"In gastric cancer, expression of all the CACNA (1G, 1H, 1I) genes was associated with overall survival (OS) among stage I-IV patients. By combining the three potential biomarkers, a TTCC signature was developed, which retained a significant association with OS both in stage IV and stage I-III patients. Alterations in CACNA gene expression are linked to tumour prognosis."
https://pharos.nih.gov/idg/targets/O43497,O43497,28806761,"Cacna1g exclusively expressed in serosal PDGFRalpha+ cells is a new pathological marker for gastrointestinal diseases."
https://pharos.nih.gov/idg/targets/O43497,O43497,28655554,"Here we show that T-type channels Cav3.1 and Cav3.2 are present in the lung and PASMCs from iPAH patients and control subjects. The blockade of T-type channels by the specific blocker, TTA-A2, prevents cell cycle progression and PASMCs growth"
https://pharos.nih.gov/idg/targets/O43497,O43497,28556246,"The results of this study provide support for Cacna1g as a genetic modifier in a mouse model of Dravet syndrome and suggest that Cav3.1 may be a potential molecular target for therapeutic intervention in patients"
https://pharos.nih.gov/idg/targets/O43497,O43497,28165634,"CACNA1G variant is associated with differential antiepileptic drug response in childhood absence epilepsy."
https://pharos.nih.gov/idg/targets/O43497,O43497,27134080,"Electrophysiological studies showed a significant increase in Cd(2+) and manganese (Mn(2+)) currents through the CaV3.1 mutants as well as a reduction in the inhibitory effect of Cd(2+) on the Ca(2+) current."
https://pharos.nih.gov/idg/targets/O43497,O43497,26715324,"In 2 families with autosomal dominant SCA, a CACNA1G mutation p.Arg1715His was found at S4 of repeat IV, the voltage sensor of the CaV3.1 which shifted it toward a positive potential."
https://pharos.nih.gov/idg/targets/O43497,O43497,26488564,"CaV3.1, CaV3.2 and CaV3.3 channels, are best recognized for their negative voltage of activation and inactivation thresholds that allow them to operate near the resting membrane potential of neurons."
https://pharos.nih.gov/idg/targets/O43497,O43497,26456284,"A Recurrent Mutation in CACNA1G Alters Cav3.1 T-Type Calcium-Channel Conduction and Causes Autosomal-Dominant Cerebellar Ataxia."
https://pharos.nih.gov/idg/targets/O43497,O43497,26056284,"CaV3.1 channel is required for the generation of a given set of thalamocortical rhythms during unconsciousness. Further, that thalamocortical resonant neuronal activity supported by this channel is important for the control of vigilance states"
https://pharos.nih.gov/idg/targets/O43497,O43497,24268883,"CaV3.1 downregulation is a major initiating factor for the increased production of the toxic Ab peptide, then the CaV3.1 T-type calcium channel represents a novel target for preventative therapeutics in Alzheimer's disease."
https://pharos.nih.gov/idg/targets/O43497,O43497,23488970,"Ethanol affects CaV3.2 but not CaV3.1 nor CaV3.3 channel isoforms."
https://pharos.nih.gov/idg/targets/O43497,O43497,22973060,"Ca(V)3.1 channels represent a likely pathway for Fe(2) entry into cells."
https://pharos.nih.gov/idg/targets/O43497,O43497,22973059,"Cd(2) carried sizable inward currents through Ca(v)3.1 channels (210 +/- 20 pA at -60 mV with 2 mM Cd(2))."
https://pharos.nih.gov/idg/targets/O43497,O43497,22574369,"The abnormal mRNA expressions of T-type channel alpha1H and alpha1G may be one of the causes of declined semen quality and infertility in varicocele patients."
https://pharos.nih.gov/idg/targets/O43497,O43497,22572848,"Augmentation of CaV3.1 currents by Ras-ERK activation is associated with enhanced trafficking of channels to the plasma membrane."
https://pharos.nih.gov/idg/targets/O43497,O43497,22469755,"Cav3.1 channels may contribute to the repression of tumor proliferation and the promotion of apoptosis mediated via Cav3.1-specific calcium signals"
https://pharos.nih.gov/idg/targets/O43497,O43497,21788606,"Data showed expression of L-type (Ca(v) 1.2), P/Q-type (Ca(v) 2.1), and T-type subtype (Ca(v) 3.1 and Ca(v) 3.2) voltage-gated calcium channels (Ca(v)s) in renal artery and dissected intrarenal blood vessels from nephrectomies."
https://pharos.nih.gov/idg/targets/O43497,O43497,21438841,"The function of T-type Ca(2+) channels is important for the proliferation of human ovarian cancer cells."
https://pharos.nih.gov/idg/targets/O43497,O43497,20435690,"Results reveal an intracellular WPb-independent P-selectin pool in pulmonary capillary endothelium, where the regulated P-selectin surface expression is triggered by Ca(2+) transients evoked through activation of the alpha(1G) T-type channel."
https://pharos.nih.gov/idg/targets/O43497,O43497,20416077,"Observational study of gene-disease association and gene-gene interaction. (HuGE Navigator)"
https://pharos.nih.gov/idg/targets/O43497,O43497,19455149,"establishing CACNA1G as a novel candidate gene for autism, these alleles do not contribute a sufficient genetic effect to explain the observed linkage, indicating that there is substantial genetic heterogeneity despite the clear linkage signal"
https://pharos.nih.gov/idg/targets/O43497,O43497,19211869,"Elevated brain levels of Cacna1g channel identify a key causal component of pure absence epilepsy and a major genetic component of the epileptogenic pathway."
https://pharos.nih.gov/idg/targets/O43497,O43497,18801335,"These results suggest that RanBPM could be a key regulator of Ca(v)3.1 channel-mediated signaling pathways."
https://pharos.nih.gov/idg/targets/O43497,O43497,18663132,"A study evaluating whether the effect of Ni(2+) on Ca(V)3.1 is affected by permeant ions is reported."
https://pharos.nih.gov/idg/targets/O43497,O43497,18663131,"This study reports the concentration dependence of currents through Ca(V)3.1 T-type calcium channels stably expressed in HEK 293 cells."
https://pharos.nih.gov/idg/targets/O43497,O43497,18591418,"The sodium channel toxins tetrodotoxin and saxitoxin interact with the alpha-subunit of T-type Ca 2+ channels."
https://pharos.nih.gov/idg/targets/O43497,O43497,17591929,"A panel of markers including at least RUNX3, CACNA1G, IGF2, and MLH1 can serve as a sensitive and specific marker panel for CIMP(Cpg island methylator phenotype)-high."
https://pharos.nih.gov/idg/targets/O43497,O43497,17446221,"Primary T-type subunit expressed in some myometrial smooth muscle cells is Cav3.1."
https://pharos.nih.gov/idg/targets/O43497,O43497,17397049,"Observational study of gene-disease association. (HuGE Navigator)"
https://pharos.nih.gov/idg/targets/O43497,O43497,17397049,"collective findings flag CACNA1G as a potential susceptibility locus for idiopathic generalized epilepsy subsyndromes"
https://pharos.nih.gov/idg/targets/O43497,O43497,16671074,"CACNA1G is a human gene for T-type Ca(v)3.1 calcium channels that is subject to extensive alternative RNA splicing"
https://pharos.nih.gov/idg/targets/O43497,O43497,15774856,"T-type voltage-operated Ca2+ channels are required for cell cycle progression and proliferation of human pulmonary artery smooth muscle cell."
https://pharos.nih.gov/idg/targets/O43497,O43497,15465033,"Data describe the construction of a new cell line stably expressing alpha(1G) and Kir2.1 subunits in HEK293 cells."
https://pharos.nih.gov/idg/targets/O43497,O43497,12752779,"The down-regulation of alpha 1G T-type calcium channel mRNA in differentiated Y79 cells is mediated primarily by decreased activity of promoter A, which could occur in conjunction with repression of the activity of promoter B."
https://pharos.nih.gov/idg/targets/O43497,O43497,12676336,"Since allele and genotype distributions of CACNA1G polymorphisms in cases studied are not remarkably different from control groups, CACNA1G is not an important susceptibility gene for childhood absence epilepsy in the Han Chinese population."
https://pharos.nih.gov/idg/targets/O43497,O43497,11927664,"Specific contribution of human T-type calcium channel isotypes (alpha(1G), alpha(1H) and alpha(1I)) to neuronal excitability."
https://pharos.nih.gov/idg/targets/Q9ULQ1,Q9ULQ1,27353380,"These findings indicate potential differential regulation of signaling processes by TPC1 and TPC2 in breast cancer cells."
https://pharos.nih.gov/idg/targets/Q9ULQ1,Q9ULQ1,26152696,"Studies suggest that both two-pore channels TPC1 and TPC2 as nicotinic acid adenine dinucleotide phosphate (NAADP) targets."
https://pharos.nih.gov/idg/targets/Q9ULQ1,Q9ULQ1,25722412,"TPC1 and TPC2 proteins play a key role in Ebola virus infection and may be effective targets for antiviral therapy."
https://pharos.nih.gov/idg/targets/Q9ULQ1,Q9ULQ1,25665131,"The TPC1 was shown to interact with citron kinase, with TPC1 overexpression affecting RhoA activity and myosin light chain phosphorylation levels in cytokinesis."
https://pharos.nih.gov/idg/targets/Q9ULQ1,Q9ULQ1,25451935,"NAADP induced marked Ca(2+) transients in HEK293 cells that stably coexpressed hTPC2 with hTPC1 or cTPC3, but failed to evoke any such response in cells that coexpressed interacting hTPC2 and rTPC3 subunits"
https://pharos.nih.gov/idg/targets/Q9ULQ1,Q9ULQ1,25157141,"TPC2, but not TPC1, caused a proliferation of endolysosomal structures, dysregulating intracellular trafficking, and cellular pigmentation."
https://pharos.nih.gov/idg/targets/Q9ULQ1,Q9ULQ1,24847115,"NAADP triggers H+ release from lysosomes and endolysomes through activation of TPC1, but that the Ca2+ -releasing ability of TPC1 will depend on the ionic composition of the acidic stores"
https://pharos.nih.gov/idg/targets/Q9ULQ1,Q9ULQ1,24776928,"TPC1 is a member of a new family of voltage-gated Na(+) channels that senses pH changes and confers electrical excitability to organelles."
https://pharos.nih.gov/idg/targets/Q9ULQ1,Q9ULQ1,22500018,"The concerted regulation of TPC1 activity by luminal Ca(2+) and by membrane potential thus provides a potential mechanism to explain NAADP-induced Ca(2+) oscillations."
https://pharos.nih.gov/idg/targets/Q9ULQ1,Q9ULQ1,22270358,"OsTPC1 plays a crucial role in TvX-induced Ca(2+) influx as a plasma membrane Ca(2+)-permeable channel consequently required for the regulation of phytoalexin biosynthesis"
https://pharos.nih.gov/idg/targets/Q9ULQ1,Q9ULQ1,19620632,"Data show that human two-pore channel TPC1 is critical for nicotinic acid adenine dinucleotide phosphate action and is likely the long sought after target channel for NAADP."
https://pharos.nih.gov/idg/targets/O95180,O95180,28972185,"human Cav3.1, Cav3.2, and Cav3.3 T-type channels specifically associate with CaM at helix 2 of the gating brake in the I-II linker of the channels."
https://pharos.nih.gov/idg/targets/O95180,O95180,28846697,"In gastric cancer, expression of all the CACNA (1G, 1H, 1I) genes was associated with overall survival (OS) among stage I-IV patients. By combining the three potential biomarkers, a TTCC signature was developed, which retained a significant association with OS both in stage IV and stage I-III patients. Alterations in CACNA gene expression are linked to tumour prognosis."
https://pharos.nih.gov/idg/targets/O95180,O95180,28655554,"Here we show that T-type channels Cav3.1 and Cav3.2 are present in the lung and PASMCs from iPAH patients and control subjects. The blockade of T-type channels by the specific blocker, TTA-A2, prevents cell cycle progression and PASMCs growth"
https://pharos.nih.gov/idg/targets/O95180,O95180,28165634,"CACNA1H variant is associated with differential antiepileptic drug response in childhood absence epilepsy."
https://pharos.nih.gov/idg/targets/O95180,O95180,27729216,"CACNA1H might be a susceptibility gene predisposing to PA with different phenotypic presentations, opening new perspectives for genetic diagnosis and management of patients with PA."
https://pharos.nih.gov/idg/targets/O95180,O95180,27258646,"There is a direct link between CACNA1H(M1549V) mutation and an increased aldosterone production. This suggests that calcium channel blockers may be beneficial in the treatment of a subset of patients with primary aldosteronism."
https://pharos.nih.gov/idg/targets/O95180,O95180,27149520,"Our data establish Stac1 as an important modulator of T-type channel expression and provide new insights into the molecular mechanisms underlying the trafficking of T-type channels to the plasma membrane."
https://pharos.nih.gov/idg/targets/O95180,O95180,26745591,"modulation of N-linked glycosylation of hCav3.2 channels may play an important physiological role"
https://pharos.nih.gov/idg/targets/O95180,O95180,26706850,"heterozygous mutations identified in a pediatric patient with chronic pain and absence seizures result in loss of channel function, with significantly smaller current densities across a wide range of voltages when co-expressed in tsA-201 cells."
https://pharos.nih.gov/idg/targets/O95180,O95180,26488564,"CaV3.1, CaV3.2 and CaV3.3 channels, are best recognized for their negative voltage of activation and inactivation thresholds that allow them to operate near the resting membrane potential of neurons."
https://pharos.nih.gov/idg/targets/O95180,O95180,26483470,"Cav3.2 channels are highly phosphorylated in the mammalian brain and establish phosphorylation as an important mechanism involved in the dynamic regulation of Cav3.2 channel gating properties"
https://pharos.nih.gov/idg/targets/O95180,O95180,26220996,"reveal an unexpected role of CaV3.2 channels in regulating NMDA-R-mediated transmission and a novel epileptogenic mechanism for human childhood absence epilepsy"
https://pharos.nih.gov/idg/targets/O95180,O95180,26216687,"Study revealed no association between the 15 tagSNPs of CACNA1A, 1C, and 1H and antiepileptic drug efficacy in the Chinese Han epileptic population; the TAGAA haplotype of CACNA1A may be a risk factor for drug resistance"
https://pharos.nih.gov/idg/targets/O95180,O95180,25931121,"The I-II loop of the Cav3.2 protein inhibits neuronal Cav3.1 and Cav3.2 channels."
https://pharos.nih.gov/idg/targets/O95180,O95180,25907736,"Recurrent gain of function mutation in calcium channel CACNA1H causes early-onset hypertension with primary aldosteronism."
https://pharos.nih.gov/idg/targets/O95180,O95180,24508802,"Data indicate that endogenous/exogenous hydrogen sulfide regulates function of T-type Ca(2+) channel Cav3.2 expressed in HEK293 cells"
https://pharos.nih.gov/idg/targets/O95180,O95180,24277868,"C456S mutation leads to substantially increased excitability of cultured neurons due to increased spontaneous firing rate."
https://pharos.nih.gov/idg/targets/O95180,O95180,23970551,"Results indicate that the S4-S5 and S6 helices from adjacent domains are energetically coupled during the activation of a low voltage-gated T-type CaV3.2 channel."
https://pharos.nih.gov/idg/targets/O95180,O95180,23903007,"It plays pivotal roles in processing of pain signals.(review)"
https://pharos.nih.gov/idg/targets/O95180,O95180,23849427,"Both Asp residues critically control the biophysical properties of Ca(v)3.2, including relative permeability between Ba2+ and Ca2+, voltage dependency of channel activation, Cd2+ blocking sensitivity, and pH effects, in distinctive ways."
https://pharos.nih.gov/idg/targets/O95180,O95180,23671274,"Data suggest a pathway in which thioredoxin (Trx) acts as a tonic, endogenous regulator of Cav3.2 channels, while heme oxygenase-1 (HO-1)-derived carbon dioxide (CO) disrupts this regulation, causing channel inhibition."
https://pharos.nih.gov/idg/targets/O95180,O95180,23669360,"Cav3.2 regulates calcineurin/NFAT pathway through both the Ca(2+) influx and calcineurin binding"
https://pharos.nih.gov/idg/targets/O95180,O95180,23626738,"A novel Cav3-KCa1.1 signaling complex has been identified where Cav3-mediated calcium entry enables KCa1.1 activation over a wide range of membrane potentials."
https://pharos.nih.gov/idg/targets/O95180,O95180,23503728,"N-linked glycosylation of Cav3.2 not only controls surface expression."
https://pharos.nih.gov/idg/targets/O95180,O95180,23488970,"Ethanol primarily affects the CaV3.2 isoform of T-type Ca(2)+ channels, acting through protein kinase C."
https://pharos.nih.gov/idg/targets/O95180,O95180,23111027,"Our results support the notion that ion channel autoimmunity might at least partially contribute to HaNDL pathogenesis and occurrence of neurological symptoms."
https://pharos.nih.gov/idg/targets/O95180,O95180,22574369,"The abnormal mRNA expressions of T-type channel alpha1H and alpha1G may be one of the causes of declined semen quality and infertility in varicocele patients."
https://pharos.nih.gov/idg/targets/O95180,O95180,22572848,"ZnT-1 enhances the activity of CaV3.1 and CaV3.2 via activation of Ras-ERK signaling pathways in the plasma membrane."
https://pharos.nih.gov/idg/targets/O95180,O95180,22564432,"Cav3.2 is differently expressed in normal pleura and malignant pleural mesothelioma"
https://pharos.nih.gov/idg/targets/O95180,O95180,22469755,"Cav3.2 channels were expressed at the membrane of large portions of cells, with no likely relation to Cav3.1 expression or apoptosis."
https://pharos.nih.gov/idg/targets/O95180,O95180,22130660,"A Ca(v)3.2/syntaxin-1A signaling complex controls T-type channel activity and low-threshold exocytosis."
https://pharos.nih.gov/idg/targets/O95180,O95180,21788606,"Data showed expression of L-type (Ca(v) 1.2), P/Q-type (Ca(v) 2.1), and T-type subtype (Ca(v) 3.1 and Ca(v) 3.2) voltage-gated calcium channels (Ca(v)s) in renal artery and dissected intrarenal blood vessels from nephrectomies."
https://pharos.nih.gov/idg/targets/O95180,O95180,21438841,"The function of T-type Ca(2+) channels is important for the proliferation of human ovarian cancer cells."
https://pharos.nih.gov/idg/targets/O95180,O95180,21099341,"Review: I-II loops of T-channels play critical roles in the trafficking and gating of these channels. This loop contains an intracellular gating brake that is essential to their ability open after small depolarizations of the membrane."
https://pharos.nih.gov/idg/targets/O95180,O95180,21084288,"functional modulation of the Ca(v)3.2 channels by Cav-3 is important for understanding the compartmentalized regulation of Ca(2+) signaling during normal and pathological processes."
https://pharos.nih.gov/idg/targets/O95180,O95180,21059758,"Present evidence that N2O-based inhibition of Cav3.2 channels is mediated by free radical signalling and results in analgesia."
https://pharos.nih.gov/idg/targets/O95180,O95180,20699644,"Ca(V)3.2 alternative splicing generates significant T-type Ca channel structural and functional diversity with potential implications relevant to cardiac developmental and pathophysiological states"
https://pharos.nih.gov/idg/targets/O95180,O95180,20201926,"Observational study and genome-wide association study of gene-disease association. (HuGE Navigator)"
https://pharos.nih.gov/idg/targets/O95180,O95180,19948975,"Observational study of gene-disease association, gene-gene interaction, gene-environment interaction, and genetic testing. (HuGE Navigator)"
https://pharos.nih.gov/idg/targets/O95180,O95180,19903827,"Review discusses mutations of the Cav3.2 isoform (CACNA1H gene) that enhance channel activity and their association with idiopathic generalized epilepsies, whereas mutations that disrupt its activity are associated with autism spectrum disorders."
https://pharos.nih.gov/idg/targets/O95180,O95180,19641113,"This study provides the first mechanistic demonstration of a nociceptive ion channel (Ca(V)3.2) modulation that may contribute to the documented analgesic properties of lipoic acid in vivo."
https://pharos.nih.gov/idg/targets/O95180,O95180,19609347,"Observational study and genome-wide association study of gene-disease association. (HuGE Navigator)"
https://pharos.nih.gov/idg/targets/O95180,O95180,19144837,"Cav3.2 T-type calcium channel point mutation has splice-variant-specific effects on function and segregates with seizure expression in a polygenic rat model of absence epilepsy."
https://pharos.nih.gov/idg/targets/O95180,O95180,19131331,"Protein kinase A activity controls the regulation of T-type CaV3.2 channels by Gbetagamma dimers."
https://pharos.nih.gov/idg/targets/O95180,O95180,18708747,"Report ligand-based virtual screening to identify new Cav3.2 channel blockers."
https://pharos.nih.gov/idg/targets/O95180,O95180,18591418,"The sodium channel toxins tetrodotoxin and saxitoxin interact with the alpha-subunit of T-type Ca 2+ channels."
https://pharos.nih.gov/idg/targets/O95180,O95180,18309285,"These results imply that Cav3.2 channel activity is capable of being increased by activation of tyrosine phosphatases, but is decreased by activation of tyrosine kinases."
https://pharos.nih.gov/idg/targets/O95180,O95180,18230611,"CaV3.2 T-type calcium channel up-regulation may account for the alteration of secretion during prostate cancer development and that these channels, by promoting the secretion of potential mitogenic factors"
https://pharos.nih.gov/idg/targets/O95180,O95180,18218623,"any mutations in the brake, including C456S, disrupted the structural integrity of the brake and its function to maintain these low voltage-activated channels closed at resting membrane potentials"
https://pharos.nih.gov/idg/targets/O95180,O95180,17696120,"Observational study of gene-disease association. (HuGE Navigator)"
https://pharos.nih.gov/idg/targets/O95180,O95180,17696120,"Variants in CACNA1H that alter channel properties are present in patients with various generalized epilepsy syndromes. These variants contribute to an individual's susceptibility to epilepsy but are not sufficient to cause epilepsy on their own."
https://pharos.nih.gov/idg/targets/O95180,O95180,17215393,"Intracellular loop connecting repeats I and II (I-II loop) control the regulation of Cav3.2 channel function and expression."
https://pharos.nih.gov/idg/targets/O95180,O95180,17156077,"Observational study of gene-disease association. (HuGE Navigator)"
https://pharos.nih.gov/idg/targets/O95180,O95180,17156077,"Case-control comparisons and the transmission disequilibrium test (TDT) both supported a coding SNP (cSNP) rs9934839 (R603R) in exon 9 as being close related to childhood absence epilepsy."
https://pharos.nih.gov/idg/targets/O95180,O95180,16973746,"Recombinant Gbetagamma subunits were used to establish that the Gbeta(2)gamma(2) dimer can selectively reconstitute the inhibition of alpha(1H) channels in isolated membrane patches."
https://pharos.nih.gov/idg/targets/O95180,O95180,16905256,"In conclusion, these data further support the hypothesis that CACNA1H is an important susceptibility gene for CAE in the Chinese Han population."
https://pharos.nih.gov/idg/targets/O95180,O95180,16754686,"Observational study of gene-disease association. (HuGE Navigator)"
https://pharos.nih.gov/idg/targets/O95180,O95180,16754686,"functional analysis shows that missense mutations significantly reduce Ca(V)3.2 channel activity and thus could affect neuronal function and potentially brain development and could contribute to the development of the ASD phenotype"
https://pharos.nih.gov/idg/targets/O95180,O95180,16565161,"CACNA1H RNA is alternatively spliced at 12-14 sites where it can destroy, create or change the regulatory specificity of predicted exonic splicing enhancer sequences that may control splicing regulation."
https://pharos.nih.gov/idg/targets/O95180,O95180,16504478,"Linkage analysis of 44 pedigrees provided no evidence for a locus in the CACNA1H region; no Chinese variants were found in 220 unrelated patients."
https://pharos.nih.gov/idg/targets/O95180,O95180,16475676,"The expression of CACNA1H in breast cancer has been confirmed by RT-PCR."
https://pharos.nih.gov/idg/targets/O95180,O95180,16443692,"inhibitory effects of amiodarone on the modified T-type Cav3.2 Ca2+ channel created by long-term amiodarone treatment"
https://pharos.nih.gov/idg/targets/O95180,O95180,16377633,"His-191 in the S3-S4 loop is a critical residue conferring nickel block to Ca(v)3.2"
https://pharos.nih.gov/idg/targets/O95180,O95180,16301824,"Cloning and calcium channel characteristics of Cav3.2 isoforms."
https://pharos.nih.gov/idg/targets/O95180,O95180,16133267,"Data indicate that Domain IV/S4 of Ca(v)3.2 is an activation domain and is not involved in inactivation from the open state."
https://pharos.nih.gov/idg/targets/O95180,O95180,15852375,"CACNA1H is a susceptibility gene in complex idiopathic generalized epilepsy"
https://pharos.nih.gov/idg/targets/O95180,O95180,15833171,"T-type calcium channel gene-CACNA1H might be a susceptibility gene to childhood absence epilepsy."
https://pharos.nih.gov/idg/targets/O95180,O95180,15498803,"recombinant low voltage-activated T-type Ca channels exhibit a small, though clearly evident, window T-type Ca(2)(+) current which is also present in native channels from different neuronal types--REVIEW"
https://pharos.nih.gov/idg/targets/O95180,O95180,14729682,"Ca(v)3.2 has a role in calcium influx during physiological activation and mutations may be causative in the propensity for seizures in patients with childhood absence epilepsy"
https://pharos.nih.gov/idg/targets/O95180,O95180,14529577,"characterization in terms of activation and inactivation properties as well as cation permeability"
https://pharos.nih.gov/idg/targets/O95180,O95180,12891677,"Observational study of gene-disease association. (HuGE Navigator)"
https://pharos.nih.gov/idg/targets/O95180,O95180,11751928,"We conclude that low voltage activated voltage-operated Ca(2+) channels are expressed in cells of the human male germ line."
