"URL","Uniprot ID","PMID","Abstract"
https://pharos.nih.gov/idg/targets/O00555,O00555,28742085,"the novel R1673P allele of CACNA1A produces neurodegenerative phenotypes in flies and human, likely due to a toxic gain of function"
https://pharos.nih.gov/idg/targets/O00555,O00555,28444220,"CACNA1A and SPG7 are major ataxia genes."
https://pharos.nih.gov/idg/targets/O00555,O00555,28377503,"Electrophysiological characterization of VDCC currents revealed that the suppressive effect of RIM2alpha on voltage-dependent inactivation (VDI) was stronger than that of RIM1alpha for the CaV2.1 variant containing the region encoded by exons 44 and 47."
https://pharos.nih.gov/idg/targets/O00555,O00555,28169007,"Whole exome sequencing technique confirmed, for the first time in the Polish population, a heterozygous T666M mutation (c.1997C>T; p.Thr666Met) in the CACNA1A gene in the proband, the proband's son and in several other family members. CONCLUSION: The presented report provides clinical and genetic insight into familial hemiplegic migraine 1 resulting from a mutation in the CACNA1A gene."
https://pharos.nih.gov/idg/targets/O00555,O00555,28131213,"To assess the gene dosage effect in SCA6 homozygotes, study determined the effect of CACNA1A CAG repeat length on the age-of-onset in heterozygotes, found that the total number of CAG repeats in both the normal and expanded alleles was inversely correlated with the age-of-onset in SCA6"
https://pharos.nih.gov/idg/targets/O00555,O00555,28096552,"The authors have identified a novel missense heterozygote variant of CACNA1A in a three generation Slovak family with recurrent episodes of ataxia."
https://pharos.nih.gov/idg/targets/O00555,O00555,27572487,"Microdomain-targeted remodeling of L-type Calcium Channels contributes to ventricular arrhyrhmias in heart failure."
https://pharos.nih.gov/idg/targets/O00555,O00555,27476654,"Mutations in SLC1A2 and CACNA1A Are Important Causes of Epileptic Encephalopathies"
https://pharos.nih.gov/idg/targets/O00555,O00555,27250579,"this report provides insight into the mutations in the CACNA1A gene and resulting pheno types and pres ents a novel inheritance pattern for this disorder."
https://pharos.nih.gov/idg/targets/O00555,O00555,26961263,"From a cohort study and literature review, authors conclude that CACNA1A mutations are more likely to be found in children with benign paroxysmal torticollis if accompanied by family histories of familial hemiplegic migraine, episodic ataxia, or paroxysmal tonic upgaze."
https://pharos.nih.gov/idg/targets/O00555,O00555,26912519,"Cav2.1 dysfunction in episodic ataxia type 2 has unexpected effects on axon excitability."
https://pharos.nih.gov/idg/targets/O00555,O00555,26814174,"Eye movement disorders are an early manifestation of CACNA1A mutations phenotype in children."
https://pharos.nih.gov/idg/targets/O00555,O00555,26747084,"The presence of SCN1A mutations and absence of mutations in ATP1A2 or CACNA1A suggest that the Polish patients represent FHM type 3."
https://pharos.nih.gov/idg/targets/O00555,O00555,26566276,"CACNA1A might play a role in the etiology of autism as demonstrated in the Chinese Han population"
https://pharos.nih.gov/idg/targets/O00555,O00555,26507659,"the consensus motifs of S-nitrosylation were much more abundant in Cav2.2 than in Cav1.2 and Cav2.1."
https://pharos.nih.gov/idg/targets/O00555,O00555,26216687,"Study revealed no association between the 15 tagSNPs of CACNA1A, 1C, and 1H and antiepileptic drug efficacy in the Chinese Han epileptic population; the TAGAA haplotype of CACNA1A may be a risk factor for drug resistance"
https://pharos.nih.gov/idg/targets/O00555,O00555,26063920,"The results of this study suggest that the polyQ carrying the CT fragment of the P/Q-type channel is sufficient to cause SCA6 pathogenesis in mice."
https://pharos.nih.gov/idg/targets/O00555,O00555,25954029,"Expression of DnaJ-1 potently suppresses alpha1ACT-dependent degeneration , concomitant with decreased aggregation of the pathogenic protein. Mutating the nuclear importer karyopherin a3 also leads to reduced toxicity from pathogenic CACNA1A"
https://pharos.nih.gov/idg/targets/O00555,O00555,25869926,"South American cohort did not confirm the effect of the four candidate loci as modifier of onset age: mithocondrial A10398G polymorphism and CAGn at RAI1, CACNA1A, ATXN3, and ATXN7 genes"
https://pharos.nih.gov/idg/targets/O00555,O00555,25784583,"This study showed that Genetic analyses identified a nonsense mutation in exon 23 which has been registered in dbSNP as a pathogenic allele."
https://pharos.nih.gov/idg/targets/O00555,O00555,25735478,"This report illustrates the phenotypic heterogeneity of CACNA1A loss-of-function mutations and stresses the cognitive and epileptic manifestations caused by the loss of CaV2.1 channels function"
https://pharos.nih.gov/idg/targets/O00555,O00555,25706626,"A genome-wide significant association between a new locus (CACNA1A rs4926244) and increased susceptibility to exfoliation syndrome."
https://pharos.nih.gov/idg/targets/O00555,O00555,25468264,"A novel nonsense mutation of the CACNA1A gene was identified in all affected family members and is most likely the disease causing molecular defect"
https://pharos.nih.gov/idg/targets/O00555,O00555,25109669,"This study preseent mouse model of episodic ataxia type 2 in missense mutation of CACNA1A."
https://pharos.nih.gov/idg/targets/O00555,O00555,24907493,"Findings suggest that the unaltered inhibitory transmission at multipolar interneuron autapses is due to the expression of specific CaV2.1 channels whose gating is barely affected by the familial hemiplegic migraine type 1 mutation"
https://pharos.nih.gov/idg/targets/O00555,O00555,24842051,"The roles of the calcium-sensing receptor (CaSR) and L-type voltage-dependent calcium channel (L-VDCC) in the proliferation and osteogenic differentiation of a calcium-exposed periodontal ligament stem/progenitor cells, were investigated ."
https://pharos.nih.gov/idg/targets/O00555,O00555,24658662,"In this review and case report, a novel CACNA1A point mutation was linked to episodic ataxia type 2."
https://pharos.nih.gov/idg/targets/O00555,O00555,24486772,"In three unrelated families with dominant cerebellar ataxia, symptoms cosegregated with CACNA1A missense mutations of evolutionary highly conserved amino acids."
https://pharos.nih.gov/idg/targets/O00555,O00555,24445160,"report here two new benign paroxysmal torticollis of infancy patients from the same family carrying a heterozygous mutation in the CACNA1A gene leading to the change p.Glu533Lys"
https://pharos.nih.gov/idg/targets/O00555,O00555,24329154,"Cav2.1 expression is inhibited by prion protein expression which competes with glycosylphosphatidylinosital-anchoring pathways."
https://pharos.nih.gov/idg/targets/O00555,O00555,24275721,"Novel mutations in CACNA1A genes are associated with episodic ataxia type 2."
https://pharos.nih.gov/idg/targets/O00555,O00555,24108129,"a genetic variant in the synprint site of the CaV2.1 channel which is characterized by a gain-of-function and associated with both hemiplegic migraine and migraine with aura in patients."
https://pharos.nih.gov/idg/targets/O00555,O00555,24046065,"We describe a novel CACNA1A mutation and an unclassified CACNA1A in-frame variant in a Swiss family presenting as the episodic ataxia type 2 phenotype associated with reduced saccade velocity."
https://pharos.nih.gov/idg/targets/O00555,O00555,23827678,"CACNA1A coordinates gene expression using a bicistronic mRNA bearing a cryptic internal ribosomal entry site (IRES). The first cistron encodes the well-characterized alpha1A subunit. The second expresses a transcription factor, alpha1ACT, which coordinates expression of a program of genes involved in neural and Purkinje cell development."
https://pharos.nih.gov/idg/targets/O00555,O00555,23726906,"Mice injected with P/Q type voltage-gated calcium channel antibodies from patients with paraneoplastic cerebellar degeneration develop marked reversible ataxia compared to controls."
https://pharos.nih.gov/idg/targets/O00555,O00555,23505410,"Cytoplasmic location of alpha1A voltage-gated calcium channel C-terminal fragment (Cav2.1-CTF) aggregate is sufficient to cause cell death."
https://pharos.nih.gov/idg/targets/O00555,O00555,23441182,"This is the first report of Type 2 episodic ataxia in a Chinese family that carries a novel mutation in CACNA1A gene and had abdominal pain as a novel phenotype associated with EA2."
https://pharos.nih.gov/idg/targets/O00555,O00555,23430985,"These results suggest that the extent of G-protein-mediated inhibition is significantly reduced in the K1336E mutant CaV2.1 Ca(2+) channels"
https://pharos.nih.gov/idg/targets/O00555,O00555,23407676,"The clinical spectrum of missense mutation in CACNA1A-related disorders is much broader than in strictly familial hemiplegic migraine."
https://pharos.nih.gov/idg/targets/O00555,O00555,23344743,"Genetic analysis identified a splice site mutation (p.Val1465Glyfs13X)and normal trinucleotide repeats in CACNA1A in all clinically affected and one unaffected members of a Korean family with EA2 with genetic anticipation"
https://pharos.nih.gov/idg/targets/O00555,O00555,23255606,"analysis of Ca2+-independent activation of Ca2+/calmodulin-dependent protein kinase II bound to the C-terminal domain of CaV2.1 calcium channels"
https://pharos.nih.gov/idg/targets/O00555,O00555,23103419,"We conclude that CACNA1A variants in some persons with Dravet syndrome may modify the epileptic phenotypes."
https://pharos.nih.gov/idg/targets/O00555,O00555,22969264,"The gene mutation analysis performed in the patient and his mother led to the identification of a heterozygous point mutation (1997C-->T, T666M) in the exon 16 of the CACNA1A gene."
https://pharos.nih.gov/idg/targets/O00555,O00555,22942164,"This observation suggests that paroxysmal sensoriphobia and digestive signs can occur together in bouts in neurological conditions other than migraine, and in the absence of head pain."
https://pharos.nih.gov/idg/targets/O00555,O00555,22549042,"The W1684R and V1696I mutations affect the apparent dissociation and reassociation rates of the Gbetagamma dimer from the channel complex, suggesting that the G protein-Ca(2+) channel affinity may be altered by the CACNA1A gene mutations."
https://pharos.nih.gov/idg/targets/O00555,O00555,22190617,"The results suggest a possible scenario through which FHM-1 mutations might increase the gain of the trigeminal nociceptive pathway."
https://pharos.nih.gov/idg/targets/O00555,O00555,22074995,"Mutations in CaV2.1 Ca2+ channels cause familial hemiplegic migraine type 1 (FHM1)."
https://pharos.nih.gov/idg/targets/O00555,O00555,21965686,"analysis of CaV2.1 channel regulation by calcium-binding protein-1"
https://pharos.nih.gov/idg/targets/O00555,O00555,21827920,"CACNA1A mutation association with Episodic ataxias 2."
https://pharos.nih.gov/idg/targets/O00555,O00555,21827907,"The Spinocerebellar ataxia type 6 is caused by a CAG repeat expansion in the CACNA1A gene which encodes the alpha1A subunit of the P/Q-type voltage-gated calcium channel."
https://pharos.nih.gov/idg/targets/O00555,O00555,21788606,"Data showed expression of L-type (Ca(v) 1.2), P/Q-type (Ca(v) 2.1), and T-type subtype (Ca(v) 3.1 and Ca(v) 3.2) voltage-gated calcium channels (Ca(v)s) in renal artery and dissected intrarenal blood vessels from nephrectomies."
https://pharos.nih.gov/idg/targets/O00555,O00555,21768184,"CACNA1A mutations can give significant symptoms other than (hemiplegic) migraine as reason for presentation."
https://pharos.nih.gov/idg/targets/O00555,O00555,21696515,"EA2 is caused by mutations in the CACNA1A gene encoding the alpha 1A subunit of the Cav2.1 calcium channel on chromosome 19p13."
https://pharos.nih.gov/idg/targets/O00555,O00555,21550405,"Pathogenic CAG expansions in Cav2.1 enhance splicing activity at the 3'end of the CACNA1A transcript, leading to a CAG repeat length-dependent increase in the levels of a Cav2.1 mRNA splice isoform and the resultant disease protein."
https://pharos.nih.gov/idg/targets/O00555,O00555,21440913,"Study of episodic ataxia 2 in neurologically mutant mice has implications in humans for a haploinsufficiency mechanism, at least for some of the Cacna1a mutations leading to a premature stop codon."
https://pharos.nih.gov/idg/targets/O00555,O00555,21183743,"A novel voltage sensor mutation in CACNA1A calcium channel is found to be responsible for recurrent stroke in a young girl."
https://pharos.nih.gov/idg/targets/O00555,O00555,21078624,"identified 118 protein interactions for CACNA1A and ATXN7 linking them to other ataxia-causing proteins and the ataxia network; ataxia network is significantly enriched for proteins that interact with known macular degeneration-causing proteins"
https://pharos.nih.gov/idg/targets/O00555,O00555,20837964,"CACNA1A gene is involved in early-onset sporadic hemiplegic migraine, in particular when associated with neurologic signs"
https://pharos.nih.gov/idg/targets/O00555,O00555,20682717,"Neurophysiological findings confirmed possible cerebral cortex and white matter involvement regardless of the clinical symptoms displayed in a family with a novel CACNA1A mutation"
https://pharos.nih.gov/idg/targets/O00555,O00555,20631222,"In transgenic knock-in Cacna1a Ser218Leu mice there are progressive and severe release aberrations of acetylcholine in familial hemiplegic migraine type 1."
https://pharos.nih.gov/idg/targets/O00555,O00555,20495360,"Demonstrated that the P/Qtype Ca2+ channel, could associate with Syt1, and the SNARE proteins to generate a distinct and kinetically active complex for depolarization-evoked neurotransmitter release."
https://pharos.nih.gov/idg/targets/O00555,O00555,20484531,"our results indicate that consequences of FHM mutations might vary according to the shape of action potentials in charge of triggering synaptic transmission"
https://pharos.nih.gov/idg/targets/O00555,O00555,20379614,"Clinical trial of gene-disease association and gene-environment interaction. (HuGE Navigator)"
https://pharos.nih.gov/idg/targets/O00555,O00555,20156848,"We conclude that variants in the coding region of CACNA1A that confer a loss of P/Q-type channel function are associated with episodic ataxia and epilepsy"
https://pharos.nih.gov/idg/targets/O00555,O00555,20129625,"Our data substantially increase the number of the described CACNA1A mutations, and propose clinical and molecular criteria for a more focused genetic screening."
https://pharos.nih.gov/idg/targets/O00555,O00555,20091047,"mutations in the gene encoding the Cav2.1 alpha1 subunit (CACNA1A) have been linked to absence seizures in both humans and rodents.["
https://pharos.nih.gov/idg/targets/O00555,O00555,20080591,"report on a mutation identified in the first intracellular loop of CACNA1A (alpha(1A(A454T))) that does not cause familial hemiplegic migraine but is associated with the absence of sensorimotor symptoms in a migraine with aura pedigree."
https://pharos.nih.gov/idg/targets/O00555,O00555,20071244,"sporadic hemiplegic migraine and epilepsy associated with CACNA2A gene mutation."
https://pharos.nih.gov/idg/targets/O00555,O00555,20069235,"Observational study of gene-disease association. (HuGE Navigator)"
https://pharos.nih.gov/idg/targets/O00555,O00555,20043243,"Transgenic leaner mice which carry autosomal recessive mutations in the CACNA1A calcium channel gene show extensive apoptotic cell death in cerebellar granule cells during postnatal development."
https://pharos.nih.gov/idg/targets/O00555,O00555,20043227,"Spinocerebellar ataxia type 6 pathogenesis may be associated with the 75-85-kDa Ca(v)2.1 C-terminal fragment, normally found in the cytoplasm, being aggregated in the cytoplasm and additionally distributed in the nucleus."
https://pharos.nih.gov/idg/targets/O00555,O00555,19864665,"Genetic analysis revealed three novel mutations in the calcium channel gene CACNA1A (chromosome 19p13)in five patients with episodic ataxia type 2"
https://pharos.nih.gov/idg/targets/O00555,O00555,19811514,"We describe a novel de novo mutation in CACNA1A (p. Arg1349Gln) in a child with severe hemiplegic migraine induced by minor head trauma."
https://pharos.nih.gov/idg/targets/O00555,O00555,19633872,"CACNA1A large deletions have roles in episodic ataxia"
https://pharos.nih.gov/idg/targets/O00555,O00555,19624685,"We describe four individuals, spanning three generations of a family, with episodic ataxia without hemiplegia and confusion, in association with a CACNA1A mutation"
https://pharos.nih.gov/idg/targets/O00555,O00555,19586927,"The authors identified five previously unreported large scale deletions in CACNA1A in seven families with episodic ataxia and in one case with hemiplegic migraine."
https://pharos.nih.gov/idg/targets/O00555,O00555,19527141,"CACNA1A polymorphisms do not represent primary predisposing factors for the pathogenesis of common migraine in Italian patients."
https://pharos.nih.gov/idg/targets/O00555,O00555,19527141,"Observational study of gene-disease association. (HuGE Navigator)"
https://pharos.nih.gov/idg/targets/O00555,O00555,19520699,"CACNA1A S218L mutation was correlated with early seizures and cerebral oedema after trivial head trauma"
https://pharos.nih.gov/idg/targets/O00555,O00555,19486177,"CACNA1A gene mutation may contribute to both typical EA2 and typical basilar-type migraine, extending the spectrum of clinical manifestations associated with CACNA1A mutations"
https://pharos.nih.gov/idg/targets/O00555,O00555,19438926,"specific, severe phenotype and the co-occurrence of hemiplegic migraine and epilepsy related to the S218L FHM1 mutation"
https://pharos.nih.gov/idg/targets/O00555,O00555,19429006,"E918D & E993V SNPs were found in 30/117 & 32/117 migraine patients; prevalence of these SNPs separately was not significantly different from controls; coexistence of both SNPs was more frequent in migraineurs than controls"
https://pharos.nih.gov/idg/targets/O00555,O00555,19429006,"Observational study of gene-disease association. (HuGE Navigator)"
https://pharos.nih.gov/idg/targets/O00555,O00555,19259763,"Observational study of gene-disease association. (HuGE Navigator)"
https://pharos.nih.gov/idg/targets/O00555,O00555,19242091,"All three familial hemiplegic migraine CAV2.1 mutations cause a greater hyperpolarizing shift in voltage-dependent properties when expressed in the short carboxyl terminus variant (Ca(V)2.1 Delta47) compared to the long variant (Ca(V)2.1 +47)"
https://pharos.nih.gov/idg/targets/O00555,O00555,19235102,"Observational study of gene-disease association. (HuGE Navigator)"
https://pharos.nih.gov/idg/targets/O00555,O00555,19189122,"Together, our data suggest that Y1245C alters the structure of the alpha(1A) voltage sensor producing an overall gain of channel function that may explain the observed clinical phenotypes."
https://pharos.nih.gov/idg/targets/O00555,O00555,19182766,"a CACNA1A mutation in the intracellular domain between s4 and s5 of repeat 3 can cause atypical nystagmus/cerebellar phenotypes, including isolated nystagmus"
https://pharos.nih.gov/idg/targets/O00555,O00555,19145126,"We report a case of nystagmus and skew deviation in a patient with spinocerebellar ataxia type 6 (SCA-6) and discuss the role of the cerebellum as a plausible mechanism for this combined pathologic condition."
https://pharos.nih.gov/idg/targets/O00555,O00555,19007941,"familial hemiplegic migraine 3 is a high resistant molecule when compared to FHM1 and FHM2"
https://pharos.nih.gov/idg/targets/O00555,O00555,18976783,"Newly characterised 5' and 3' regions of CACNA1A gene harbour mutations associated with Familial Hemiplegic Migraine and Episodic Ataxia."
https://pharos.nih.gov/idg/targets/O00555,O00555,18973067,"Observational study of gene-disease association. (HuGE Navigator)"
https://pharos.nih.gov/idg/targets/O00555,O00555,18940563,"CACNA1A gene revealed a de novo Ile712Val sequence variant in patient with seizures, ataxia, headache, a decreased level of consciousness, and motor regression, with a background of mental retardation and mild cerebellar atrophy"
https://pharos.nih.gov/idg/targets/O00555,O00555,18758887,"report of a two-generation family with several individuals affected, with benign paroxysmal tonic upgaze, benign paroxysmal torticollis or episodic ataxia; a heterozygous point mutation in exon 18 of CACNA1A (c.2206C>T)was identified"
https://pharos.nih.gov/idg/targets/O00555,O00555,18755274,"proband identified with severe myoclonic epilepsy in infancy heterozygous for de novo SCN1A nonsense mutation & CACNB4 missense mutation (R468Q); greater Ca(v)2.1 currents caused by the mutation may increase neurotransmitter release in excitatory neurons"
https://pharos.nih.gov/idg/targets/O00555,O00555,18670797,"study reports a Japanese family with a T666M missense mutation in the protein encoded by CACNA1A; affected members demonstrated a broad clinical spectrum; despite the variability, all members exhibited marked downbeat positioning nystagmus"
https://pharos.nih.gov/idg/targets/O00555,O00555,18644040,"Two novel CACNA1A variants, p.Val581Met and p.Tyr1245Cys, and a previously annotated change, p.Cys1534Ser, were identified in individuals with hemiplegic migraine, although they have not yet been proven to be pathogenic"
https://pharos.nih.gov/idg/targets/O00555,O00555,18606230,"Three novel stop code mutations in CaV2.1 causing episodic ataxia type 2 do not affect alternate exon 37B. These findings reveal unexpected dependence of cerebellar function on intact exon 37A-containing Ca(V)2.1 channels."
https://pharos.nih.gov/idg/targets/O00555,O00555,18602318,"Episodic ataxia type 2 shows ictal hyperhidrosis with hypothermia and interictal chronic diarrhea due to a novel CACNA1A mutation coding for Y248C."
https://pharos.nih.gov/idg/targets/O00555,O00555,18581134,"The S218L familial hemiplegic migraine mutation promotes deinhibition of Ca(v)2.1 calcium channels during direct G-protein regulation."
https://pharos.nih.gov/idg/targets/O00555,O00555,18541804,"Genotyping of CACNA1A shows nonmendelian inheritance of a CAG repeat located at the 3' end of the gene in a mother and daughter and suggests a deletion of several exons of CACNA1A, which is subsequently confirmed."
https://pharos.nih.gov/idg/targets/O00555,O00555,18513263,"4 new variants were found in exons of the CACNA1A gene in sporadic hemiplegic migraine patients. It does not seem that CACNA1A is a major gene in SHM."
https://pharos.nih.gov/idg/targets/O00555,O00555,18513263,"Observational study of gene-disease association. (HuGE Navigator)"
https://pharos.nih.gov/idg/targets/O00555,O00555,18498393,"These results also suggest that CACNA1A mutation scanning is indicated in patients with a severe neurological phenotype that includes paroxysmal (alternating) hemiplegia."
https://pharos.nih.gov/idg/targets/O00555,O00555,18478327,"These results suggest that in some case of Guillain-Barre syndrome, particularly of acute motor axonal neuropathy patients with IgG anti-GM1 mAb, muscle weakness may be induced by dysfunction of Cav2.1 VDCC functioning at the motor nerve terminals."
https://pharos.nih.gov/idg/targets/O00555,O00555,18437043,"Report highlights profound phenotypic variability that can be associated with CACNA1A mutations associated with cerebellar ataxia."
https://pharos.nih.gov/idg/targets/O00555,O00555,18413478,"To identify early abnormalities of ocular motor function in individuals who have the spinocerebellar ataxia type 6 (SCA6) gene (CACNA1A) but no clinical symptoms."
https://pharos.nih.gov/idg/targets/O00555,O00555,18400034,"CACNA1A a frequent recurrent mutation in hemiplegic migraine."
https://pharos.nih.gov/idg/targets/O00555,O00555,18338196,"This family was found to have a novel mutation at codon 1451 of the Ca2+ channel alpha 1A subunit. Excitability testing may prove a convenient screening test for patients with this suspected channelopathy."
https://pharos.nih.gov/idg/targets/O00555,O00555,18313928,"This study present three siblings with the mutation(CACNA1A S218L) with the novel association of childhood seizures, and highlight the dynamic changes seen on electroencephalography during hemiplegic migraine attacks."
https://pharos.nih.gov/idg/targets/O00555,O00555,18285829,"A core CACNA1A disease haplotype was found in affected individuals across the globe."
https://pharos.nih.gov/idg/targets/O00555,O00555,18279427,"T666M CACNA1A mutation in early onset familial hemiplegic migraine type 1 with cerebellar atrophy and mental retardation"
https://pharos.nih.gov/idg/targets/O00555,O00555,18162541,"CaV2.1 channels are modulated by Ca2+/calmodulin-dependent protein kinase II bound to the C-terminal domain"
https://pharos.nih.gov/idg/targets/O00555,O00555,18056581,"Sequence variants were identified in seven SHM patients: one CACNA1A mutation, five ATP1A2 mutations, and one SCN1A polymorphism. All six mutations caused functional changes in cellular assays."
https://pharos.nih.gov/idg/targets/O00555,O00555,17672918,"validated occurrence of unusual TG 3' splice sites in intron 9"
https://pharos.nih.gov/idg/targets/O00555,O00555,17654512,"Dominant-negative effects of EA2 mutations involve disruption of membrane trafficking of human PQ-type Ca2+ channels."
https://pharos.nih.gov/idg/targets/O00555,O00555,17588611,"Early onset progressive ataxia associated with the first CACNA1A mutation identified within the I-II loop."
https://pharos.nih.gov/idg/targets/O00555,O00555,17573560,"The alpha1A subunit, CACNA1A, is the specific pore-forming structure in P/Q-type voltage-dependent calcium channels found only in neurons. The role of these channels and CACNA1A mutations in neurological diseases is emphasized. Review."
https://pharos.nih.gov/idg/targets/O00555,O00555,17438119,"Ion channel gating is regulated by calcium and calmodulin binding."
