"URL","Uniprot ID","PMID","Abstract"
https://pharos.nih.gov/idg/targets/Q13936,Q13936,19916019,"linkage of CaV1.2 channel polymorphism with bipolar disorder, depression, and schizophrenia. Alternative splicing modulates CaV1.2 channelopathy and the role of CaV1.2 channel in both excitable and non-excitable tissues[review]"
https://pharos.nih.gov/idg/targets/Q13936,Q13936,19913121,"Observational study of gene-disease association. (HuGE Navigator)"
https://pharos.nih.gov/idg/targets/Q13936,Q13936,19781653,"The rs1006737 variant of CACNA1C does influence language production on a semantic level in conjunction with the underlying neural systems."
https://pharos.nih.gov/idg/targets/Q13936,Q13936,19781653,"Observational study of gene-disease association. (HuGE Navigator)"
https://pharos.nih.gov/idg/targets/Q13936,Q13936,19717733,"Ca(v)1.2 splice variant with exon 9* is critical for regulation of cerebral artery diameter."
https://pharos.nih.gov/idg/targets/Q13936,Q13936,19687230,"Structural changes induced by mutation A780P may disturb the voltage-sensing domain."
https://pharos.nih.gov/idg/targets/Q13936,Q13936,19625771,"the L-type channel is the major route of Ca(2+) entry in response to repetitive or prolonged depolarization of skeletal muscle"
https://pharos.nih.gov/idg/targets/Q13936,Q13936,19621016,"We found that the risk allele conferred increased risk for schizophrenia (P=0.034) and recurrent major depression (P=0.013) with similar effect sizes to those previously observed in BD (allelic odds ratio approximately 1.15)"
https://pharos.nih.gov/idg/targets/Q13936,Q13936,19621016,"Observational study of gene-disease association. (HuGE Navigator)"
https://pharos.nih.gov/idg/targets/Q13936,Q13936,19620129,"Cardiac overexpression of a Ca(2+)-channel beta(2a)-subunit alone is sufficient to induce Ca(2+)-channel properties characteristic of chronic human heart failure."
https://pharos.nih.gov/idg/targets/Q13936,Q13936,19520970,"L-type calcium channel blockers exert an antiinflammatory effect by suppressing expression of plasminogen receptors on macrophages."
https://pharos.nih.gov/idg/targets/Q13936,Q13936,19492014,"The structural organization of Ca(v)1.2 channels in the plasma membrane depends on the type of Ca(v)beta subunits present."
https://pharos.nih.gov/idg/targets/Q13936,Q13936,19388002,"Observational study of gene-disease association, gene-environment interaction, and pharmacogenomic / toxicogenomic. (HuGE Navigator)"
https://pharos.nih.gov/idg/targets/Q13936,Q13936,19351867,"Overexpression of the intracellular II-III loop domains of Cav1.2 and Cav1.3 can dislodge the corresponding endogenous channels from the lipid raft regions of the membrane in rat insulinoma (INS-1) cells."
https://pharos.nih.gov/idg/targets/Q13936,Q13936,19279214,"Ca(V)1.2 channels are shown to be a mixture of monomers/dimers and a point mutation in the pre-IQ region predicted to abolish the coiled-coil structure significantly reduces Ca(2+)-dependent inactivation of heterologously expressed Ca(V)1.2 channels"
https://pharos.nih.gov/idg/targets/Q13936,Q13936,19265197,"Coupled and independent contributions of residues in IS6 and IIS6 to activation gating of CaV1.2."
https://pharos.nih.gov/idg/targets/Q13936,Q13936,19225208,"Three SNPs in CACNA1D or CACNA1C are genetic polymorphisms conferring sensitivity to the antihypertensive effects of L-type dCCBs in patients with hypertension."
https://pharos.nih.gov/idg/targets/Q13936,Q13936,19225208,"Observational study of gene-disease association, gene-environment interaction, and pharmacogenomic / toxicogenomic. (HuGE Navigator)"
https://pharos.nih.gov/idg/targets/Q13936,Q13936,19215628,"We identified a group of markers occurring within the CACNA1C gene (encoding the alpha subunit of the calcium channel Cav1.2)."
https://pharos.nih.gov/idg/targets/Q13936,Q13936,19205682,"Observational study of gene-disease association, gene-environment interaction, and pharmacogenomic / toxicogenomic. (HuGE Navigator)"
https://pharos.nih.gov/idg/targets/Q13936,Q13936,19106618,"Report functional properties of the CaV1.2 calcium channel activated by calmodulin in the absence of alpha2delta subunits."
https://pharos.nih.gov/idg/targets/Q13936,Q13936,19065143,"Observational study and genome-wide association study of gene-disease association. (HuGE Navigator)"
https://pharos.nih.gov/idg/targets/Q13936,Q13936,18927079,"activation of the RyR1 signaling cascade by Ca(v)1.2 may be important in the early stages of infection, providing the immune system with a rapid mechanism to initiate an early response"
https://pharos.nih.gov/idg/targets/Q13936,Q13936,18836301,"mutations in the lower part of IIS6 may affect conformations of interacting segments."
https://pharos.nih.gov/idg/targets/Q13936,Q13936,18711365,"found further support for the previously reported CACNA1C (alpha 1C subunit of the L-type voltage-gated calcium channel in bipolar disorder"
https://pharos.nih.gov/idg/targets/Q13936,Q13936,18711365,"Observational study and genome-wide association study of gene-disease association. (HuGE Navigator)"
https://pharos.nih.gov/idg/targets/Q13936,Q13936,18675806,"Cav1.2 is subject to \"denitration\"."
https://pharos.nih.gov/idg/targets/Q13936,Q13936,18618671,"Observational study of gene-disease association. (HuGE Navigator)"
https://pharos.nih.gov/idg/targets/Q13936,Q13936,18603601,"Sorcin modulates cardiac L-type Ca2+ current by functional interaction with the alpha1C subunit in rabbits."
https://pharos.nih.gov/idg/targets/Q13936,Q13936,18596041,"CO, a product of heme catabolism by HO-1, directly inhibits alpha1C subunit of the cardiac L-type Ca2+ channel"
https://pharos.nih.gov/idg/targets/Q13936,Q13936,18536931,"Introduction into Ca(v)2.1 of the homologous mutation of Ca(v)1.2 causing the Timothy syndrome questions the role of V421 in the phenotypic definition of P-type Ca(2+) channel."
https://pharos.nih.gov/idg/targets/Q13936,Q13936,18535142,"Coexpression of exogenous CaM (CaM(ex)) with alpha(1C)/alpha(2)delta in COS1 cells in the absence of Ca(v)beta subunits stimulates the plasma membrane targeting of alpha(1C)."
https://pharos.nih.gov/idg/targets/Q13936,Q13936,18359894,"Suggest that the decreased BAY K 8644 effects on Cav1.2 channels in failing cardiac myoyctes is caused by increased basal channel activity."
https://pharos.nih.gov/idg/targets/Q13936,Q13936,18317468,"Genome-wide association study of gene-disease association. (HuGE Navigator)"
https://pharos.nih.gov/idg/targets/Q13936,Q13936,18250309,"study found that the Timothy syndrome mutation powerfully and selectively slows voltage-dependent inactivation while sparing or possibly speeding the kinetics of calcium-dependent inactivation"
https://pharos.nih.gov/idg/targets/Q13936,Q13936,18174367,"Knckout mice mice exhibit significant impairments in spatial memory when examined 30 days after training."
https://pharos.nih.gov/idg/targets/Q13936,Q13936,17950697,"CS(L) modulates Ca2+-channel activity through interacting with the calmodulin-binding site on the C-terminal tail of the Cav1.2 channel."
https://pharos.nih.gov/idg/targets/Q13936,Q13936,17942635,"The COOH terminus of hCa(v)1.2b contains sites for the SH2 and SH3 binding of Src kinase."
https://pharos.nih.gov/idg/targets/Q13936,Q13936,17916557,"a smooth muscle Ca(v)1.2 splice variant has been identified functionally to possess biophysical property that can be linked to enhanced state-dependent block by DHP"
https://pharos.nih.gov/idg/targets/Q13936,Q13936,17593353,"Indirect evidence for an impaired src kinase regulation of I (Ca,L) together with an increased phosphatase activity suggests that a complex alteration in the kinase/phosphatase balance leads to I (Ca,L) dysregulation in chronic AF."
https://pharos.nih.gov/idg/targets/Q13936,Q13936,17224476,"loss-of-function mutations in genes encoding the cardiac L-type calcium channel to be associated with a familial sudden cardiac death syndrome in which a Brugada syndrome phenotype is combined with shorter-than-normal QT intervals"
https://pharos.nih.gov/idg/targets/Q13936,Q13936,17173968,"testosterone inhibits currents in a concentration-dependent manner over the physiological range of testosterone concentrations (IC50 34 nM), and is not mimicked by the metabolite 5alpha-androstan-17beta-ol-3-one (DHT), nor by progesterone or estradiol."
https://pharos.nih.gov/idg/targets/Q13936,Q13936,17071743,"localized changes in cytokine expression generated by inflammation in atherosclerosis affect alternative splicing of the Ca(v)1.2alpha1 gene"
https://pharos.nih.gov/idg/targets/Q13936,Q13936,16820363,"voltage-dependent facilitation of the Ca(v)1.2 channel depends on the phosphorylation of Ser1512/Ser1570 by calmodulin kinase II"
https://pharos.nih.gov/idg/targets/Q13936,Q13936,16648185,"We conclude that Rem is capable of regulating L-type current, that release of Rem block is modulated by cellular kinase pathways, and that the Ca(V)1.2 COOH terminus contributes to Rem-dependent channel inhibition."
https://pharos.nih.gov/idg/targets/Q13936,Q13936,16610939,"Observational study of gene-environment interaction and pharmacogenomic / toxicogenomic. (HuGE Navigator)"
https://pharos.nih.gov/idg/targets/Q13936,Q13936,16610939,"single nucleotide polymorphisms in CANCA1C had significant associations with antihypertensive outcome, combining to yield a positive treatment outcome of less than 15 to 80%"
https://pharos.nih.gov/idg/targets/Q13936,Q13936,16319140,"Ahnak has a critical role in cardiac Ca(V)1.2 calcium channel function and its beta-adrenergic regulation"
https://pharos.nih.gov/idg/targets/Q13936,Q13936,16299511,"The high-resolution structure of the Ca(2+)/CaM-Ca(V)1.2 IQ domain complex was reported."
https://pharos.nih.gov/idg/targets/Q13936,Q13936,16285952,"The activation of p50 and p65 by tumor necrosis factor alpha suppresses the expression of the alpha1C subunit of Cav1.2 channels in human colonic circular smooth muscle cells"
https://pharos.nih.gov/idg/targets/Q13936,Q13936,16157588,"analysis of conformation and binding of CaV1.2"
https://pharos.nih.gov/idg/targets/Q13936,Q13936,16020652,"L-type Ca(2+) channels play a critical role in maintaining lower esophageal sphinctor tone."
https://pharos.nih.gov/idg/targets/Q13936,Q13936,15980432,"the NT and IQ-domains of alpha(1)1.2 mediate functionally distinct interactions with CaBP1 and CaM that promote conformational alterations that either stabilize or inhibit inactivation of Ca(v)1.2."
https://pharos.nih.gov/idg/targets/Q13936,Q13936,15980164,"the physicochemical properties of the amino acid residues at positions 1144 and 1152 are crucial to the CaV1.2 pore's ability to distinguish between multiple Ba(2+) ions and Ca(2+) ions"
https://pharos.nih.gov/idg/targets/Q13936,Q13936,15863612,"data indicate that gain-of-function mutations of CaV1.2 exons 8 and 8A cause distinct forms of Timothy syndrome"
https://pharos.nih.gov/idg/targets/Q13936,Q13936,15845581,"activation of Ca(2+) conductance and Ca(2+)-dependent inactivation depend on extracellular Ca(2+) and are linked to changes in selectivity"
https://pharos.nih.gov/idg/targets/Q13936,Q13936,15749491,"Expression of undeleted L-type calcium channel mRNAs correlates with normal testes cadmium and increased sperm count after varicocelectomy"
https://pharos.nih.gov/idg/targets/Q13936,Q13936,15671035,"cross-talk between the alpha1C C and N termini, beta subunit, and the cytoplasmic pore region confers the multifactorial regulation of Ca(v)1.2 channels"
https://pharos.nih.gov/idg/targets/Q13936,Q13936,15583004,"Ca(2+)-calmodulin assumes a novel conformation when it is part of a complex with the C-terminal tail of the Ca(V)1.2 alpha(1) subunit"
https://pharos.nih.gov/idg/targets/Q13936,Q13936,15454078,"Timothy syndrome results from a Ca(V)1.2 missense mutation. Ca(V)1.2 is expressed in all affected tissues. Functional expression reveals that G406R produces maintained inward Ca(2+) currents by causing loss of voltage-dependent channel inactivation."
https://pharos.nih.gov/idg/targets/Q13936,Q13936,15339916,"short splice variants of the human cardiac Cavbeta2 subunit are involved in modulation of the Cav1.2 channel"
https://pharos.nih.gov/idg/targets/Q13936,Q13936,15299022,"there are extensive splice variations in the human l-type voltage-gated calcium channel, Cav1.2 alpha1 subunit"
https://pharos.nih.gov/idg/targets/Q13936,Q13936,14981074,"functional but non-voltage-gated L-type Ca2+ channels are expressed at the plasma membrane in T cells and play a role in the antigen receptor-mediated Ca2+ flux in these cells"
https://pharos.nih.gov/idg/targets/Q13936,Q13936,14722109,"the inhibitory modulation of cardiac Ca2+ channels, present in both alpha(1C) isoforms, is G(q)- and PLC-independent and Ca(2+)-dependent, but only basal levels of Ca(2+) are essential"
https://pharos.nih.gov/idg/targets/Q13936,Q13936,12962146,"there are multiple residues within the inhibitory domain that are crucial to the inhibitory process as well as to the enhancement of expressed current by intracellular application of proteases"
https://pharos.nih.gov/idg/targets/Q13936,Q13936,12832067,"tissue-secific expression of two isoforms under the control of distinct 5' flanking regulatory elements"
https://pharos.nih.gov/idg/targets/Q13936,Q13936,12593842,"determination of whether the expression of this channel is regulated by different promoters in smooth muscle cells and in heart"
https://pharos.nih.gov/idg/targets/Q13936,Q13936,12163037,"new promoter which exhibits 69% homology to its rat counterpart and displays functional promoter activity when transfected into heart cells in culture in luciferase-expressing constructs"
https://pharos.nih.gov/idg/targets/Q13698,Q13698,28978442,"Study used structure modeling and MD simulations to predict pathogenic omega-currents in CaV1.1 and CaV1.3 Ca(2+) channels bearing several S4 charge mutations: omega-currents conducted in resting state, but not during voltage-sensing domain activation. Mechanism responsible depends on the number of charges in S4, the position of the mutated S4 charge and countercharges, and the nature of the replacing amino acid."
https://pharos.nih.gov/idg/targets/Q13698,Q13698,28012042,"Study identified by exome sequencing both recessive and dominant CACNA1S mutations as a cause of a congenital myopathy characterized by peculiar morphological hallmarks in a cohort of 11 patients from 7 families."
https://pharos.nih.gov/idg/targets/Q13698,Q13698,27129199,"These results provide new insights into the role of muscle-specific proteins on the structural arrangement of alpha1S intracellular loops and point to a new conformational effect of the beta1a subunit in supporting skeletal muscle excitation-contraction coupling."
https://pharos.nih.gov/idg/targets/Q13698,Q13698,26433613,"whole-exome next-generation sequencing was used to identify a mutation in the CACNA1S gene, R900S, which is a rare mutation associated with hypokalemic periodic paralysis; study provides further evidence for the phenotypic variation and pharmacogenomics of hypokalemic periodic paralysis"
https://pharos.nih.gov/idg/targets/Q13698,Q13698,26252573,"CACNA1S and SCN4A mutations are relatively rare in patients with hypokalemic periodic paralysis"
https://pharos.nih.gov/idg/targets/Q13698,Q13698,25735680,"Defects in the genes coding for the skeletal muscle ryanodine receptor and alpha 1 subunit of the dihydropyridine receptor (CACNA1S) have been identified as causative for malignant hyperthermia."
https://pharos.nih.gov/idg/targets/Q13698,Q13698,25658027,"The authors found one and three rare variants of unknown significance in CACNA1S in the Malignant Hyperthermia and Exertional Heat cohorts"
https://pharos.nih.gov/idg/targets/Q13698,Q13698,24013571,"Exome sequencing revealed one rare cacna1s nonsynonymous variant in a family with malignant hyperthermia"
https://pharos.nih.gov/idg/targets/Q13698,Q13698,23888875,"Aberrant splicing of Cav 1.1 may alter intracellular Ca(2+) signalling in myotonic dystrophy 1 and 2 myotubes.  The differing dysregulation of intracellular Ca(2+) handling in DM1 and DM2 may explain their distinct sarcolemmal hyperexcitabilities."
https://pharos.nih.gov/idg/targets/Q13698,Q13698,22927026,"Data indicate that the presence of either one of these JP-45 variants decreased the sensitivity of the dihydropyridine receptor DHPR to activation."
https://pharos.nih.gov/idg/targets/Q13698,Q13698,22140091,"Misregulated splicing and altered gating of Ca(V)1.1 calcium channel is associated with muscle weakness in myotonic dystrophy."
https://pharos.nih.gov/idg/targets/Q13698,Q13698,21855088,"A novel mutation in the CACNA1S gene--p.Arg900Gly--is found in a patient with hypokalemic periodic paralysis; this mutation is subsequently found to affect some of the patient's other family members."
https://pharos.nih.gov/idg/targets/Q13698,Q13698,21845430,"Affected members of a 5-generation Chinese family with hypokalemic periodic paralysis patients had a novel His916Gln mutation in all male HypoPP patients of the family.  Penetrance of the mutation was complete in male carriers, but not female carriers."
https://pharos.nih.gov/idg/targets/Q13698,Q13698,21841462,"All familial periodic paralysis patients studied have mutations in either CACNA1S or SCN4A, but only 4 sporadic periodic paralysis patients have de novo mutations in CACNA1S (R1239H) and SCN4A (R669x2, R1135H)."
https://pharos.nih.gov/idg/targets/Q13698,Q13698,21774221,"Three SNPs of CACNA1S gene exon 11 were found but could not be associated with thyrotoxic hypokalemic periodic paralysis in people of Han Nationality in Sichuan."
https://pharos.nih.gov/idg/targets/Q13698,Q13698,21262876,"Expression of transgenic variants of dihydropyridine receptor (alpha1DHPR) subunit leads to replacement of native channels interacting with ryanodine receptor 1 (RyR1), demonstrating molecular remodelling in adult skeletal muscle fibers."
https://pharos.nih.gov/idg/targets/Q13698,Q13698,21248738,"Mutations in the affected genes cause Malignant Hyperthermia."
https://pharos.nih.gov/idg/targets/Q13698,Q13698,20861472,"All individuals in the Italian family with malignant hyperthermia showed cosegregation of informative markers close to the voltage-dependent Ca2+ channel alpha-1S-subunit gene. Sequence analysis showed a c.4060A>T transversion."
https://pharos.nih.gov/idg/targets/Q13698,Q13698,20424473,"Observational study of gene-disease association. (HuGE Navigator)"
https://pharos.nih.gov/idg/targets/Q13698,Q13698,20379614,"Clinical trial of gene-disease association and gene-environment interaction. (HuGE Navigator)"
https://pharos.nih.gov/idg/targets/Q13698,Q13698,19825159,"The study identified a single potentially pathogenic change in CACNA1S (p.Arg174Trp), and highlights that the haplotype structure across CACNA1S is diverse, with a high degree of variability"
https://pharos.nih.gov/idg/targets/Q13698,Q13698,19825159,"Observational study of gene-disease association. (HuGE Navigator)"
https://pharos.nih.gov/idg/targets/Q13698,Q13698,19779499,"Results identify a new mutation in CACNA1S and expand the spectrum of CACNA1S mutations associated with HypoPP."
https://pharos.nih.gov/idg/targets/Q13698,Q13698,19191329,"Observational study of gene-disease association. (HuGE Navigator)"
https://pharos.nih.gov/idg/targets/Q13698,Q13698,19187971,"A novel method to detect autoantibodies to dihydropyridine receptor (DHPR), found increased DHPR antibody in myasthenia gravis patients compared to controls."
https://pharos.nih.gov/idg/targets/Q13698,Q13698,19134469,"Ca(V)1.1 Delta 29 splice variant revealed the structural bases underlying the specific gating properties of skeletal muscle Ca(2+) channels, and suggests the existence of a distinct mode of excitation-contraction coupling in developing muscle"
https://pharos.nih.gov/idg/targets/Q13698,Q13698,19118277,"All mutations affected CACNA1S arginine residues, consistent with the gating pore cation leak hypothesis of hypokalemic periodic paralysis. Arginine mutations in S4 segments underlie 90% of hypokalemic periodic paralysis cases."
https://pharos.nih.gov/idg/targets/Q13698,Q13698,18229654,"A Polish three-generation family with hypokalemic periodic paralysis and a mutation in CACNA1S is investigated."
https://pharos.nih.gov/idg/targets/Q13698,Q13698,17587224,"We propose that CACNA1S mutations may comprise a previously unrecognized genetic risk factor in a greater spectrum of motor unit disorders including amyotrophic lateral sclerosis."
https://pharos.nih.gov/idg/targets/Q13698,Q13698,15726306,"a novel Arg528Gly mutation in the CACNA1S gene that causes Hypokalemic periodic paralysis in a Chinese family"
https://pharos.nih.gov/idg/targets/Q13698,Q13698,15716625,"a mutation of the CACNA1S gene may have a role in hypokalemic periodic paralysis"
https://pharos.nih.gov/idg/targets/Q13698,Q13698,15711422,"Observational study of gene-disease association. (HuGE Navigator)"
https://pharos.nih.gov/idg/targets/Q13698,Q13698,15072700,"Observational study of gene-disease association. (HuGE Navigator)"
https://pharos.nih.gov/idg/targets/Q13698,Q13698,12636044,"polymorphisms in the CACNA1S gene is associated with Malignant Hyperthermia"
https://pharos.nih.gov/idg/targets/Q01668,Q01668,28978442,"Study used structure modeling and MD simulations to predict omega-currents in CaV1.1 and CaV1.3 channel VSDs when one of the first three S4 gating charges harbors a disease-causing mutation. Using site-directed mutagenesis and electrophysiology, experimentally confirmed that the mutation of R3 charge to His in VSD III of CaV1.3 channels results in an omega-current at hyperpolarizing potentials."
https://pharos.nih.gov/idg/targets/Q01668,Q01668,28584016,"Mutations in CACNA1D cause the excessive autonomous aldosterone secretion of Aldosterone-producing Adenomas."
https://pharos.nih.gov/idg/targets/Q01668,Q01668,28584012,"CACNA1D mutations predominate in small zona glomerulosa (ZG)-like Aldosterone-producing Adenomas."
https://pharos.nih.gov/idg/targets/Q01668,Q01668,27932504,"While the relative contribution of Cav1.3 to intestinal Ca(2+) absorption and its value as a therapeutic target remain to be established, we postulate that Cav1.3 downregulation in IBD may contribute to the negative systemic Ca(2+) balance, to increased bone resorption, and to reduced bone mineral density in IBD patients."
https://pharos.nih.gov/idg/targets/Q01668,Q01668,27915047,"These results provide the evidence of a direct regulatory role of Snapin on Cav1.3 channels in atrial myocytes."
https://pharos.nih.gov/idg/targets/Q01668,Q01668,27572936,"E2 upregulated the expression of Cav1.3 for Ca2+ influx to promote the expression of p-ERK1/2 for cell proliferation in breast cancer cells"
https://pharos.nih.gov/idg/targets/Q01668,Q01668,27390944,"The CACNA1C-L762F mutation is associated with development of long QT syndrome through slower channel inactivation and increased sustained and window current.  Timothy syndrome -associated mutations localize to specific areas of CACNA1C and are associated with a younger age at presentation, higher QTc, and 2:1 AV block than isolated LQTS-associated mutations."
https://pharos.nih.gov/idg/targets/Q01668,Q01668,26606680,"patients with CACNA1D mutations displayed characteristics similar to wild-type aldosterone-producing adenomas"
https://pharos.nih.gov/idg/targets/Q01668,Q01668,26586120,"LRP1B, BRD2 and CACNA1D are new candidate genes in fetal metabolic programming of newborns exposed to maternal hyperglycemia."
https://pharos.nih.gov/idg/targets/Q01668,Q01668,26351028,"Different mutations (KCNJ5, ATP1A1, ATP2B3, and CACNA1D) are found in different aldosterone-producing nodules from the same adrenal, suggesting that somatic mutations are independent events triggered by mechanisms that remain to be identified."
https://pharos.nih.gov/idg/targets/Q01668,Q01668,26285814,"Mutations in CACNA1D gene is associated with aldosterone-producing adenomas."
https://pharos.nih.gov/idg/targets/Q01668,Q01668,26255836,"CACNA1D might not be a risk gene for SCZ in Han Chinese population, which add to the current state of knowledge regarding the susceptibility of CACNA1D to schizophrenia."
https://pharos.nih.gov/idg/targets/Q01668,Q01668,26049024,"In overall, we provide evidence that Cav1.2 and Cav1.3 isoforms are capable of potentially functioning as zinc permeation routes, through which zinc entry can be differentially augmented by mild acidifications."
https://pharos.nih.gov/idg/targets/Q01668,Q01668,25966695,"Studies indicate a role for L-type calcium channel Cav1.3 and Cav1.4 in cochlear inner hair cells (IHCs) and retinal photoreceptors (PRs)."
https://pharos.nih.gov/idg/targets/Q01668,Q01668,25966692,"Studies indicate the function of L-type calcium channels Cav1.3 in chromaffin cells."
https://pharos.nih.gov/idg/targets/Q01668,Q01668,25805831,"Cav1.3 was overexpressed in atypical hyperplasia and endometrial carcinoma, and the estrogen-induced phosphorylation of downstream molecular ERK1/2 and CREB is the result of activation of the GPER pathway."
https://pharos.nih.gov/idg/targets/Q01668,Q01668,25620733,"Study found that two de novo CACNA1D missense mutations affect evolutionary highly conserved regions in the channel's activation gate and disrupt normal channel activity by inducing a pronounced gain of channel function"
https://pharos.nih.gov/idg/targets/Q01668,Q01668,25538241,"ablation of Cav1.3 results in a decrease in the protein expression of myosin light chain 2, which interacts and increases the membrane localization of SK2 channels."
https://pharos.nih.gov/idg/targets/Q01668,Q01668,25249183,"A meta-analysis of genome-wide association studies of blood pressure and hypertension in Chinese identified three new loci (CACNA1D, CYP21A2, and MED13L) and a newly discovered variant near SLC4A7."
