"URL","Uniprot ID","PMID","Abstract"
https://pharos.nih.gov/idg/targets/O00555,O00555,17418573,"Hypokalaemic periodic paralysis due to the CACNA1S R1239H mutation in a large African family."
https://pharos.nih.gov/idg/targets/O00555,O00555,17292920,"Direct sequencing of CACNA1A identified a heterozygous 1360G>A mutation in exon 11 resulting in the substitution of alanine for threonine at residue 454 in two patients with hereditary ataxia."
https://pharos.nih.gov/idg/targets/O00555,O00555,17289272,"Functional studies of KLHL1 on P/Q-type current properties reveal a significant increase in mean current density in the presence of KLHL1."
https://pharos.nih.gov/idg/targets/O00555,O00555,17119788,"study to identify whether CACNA1A and ATP1A2 are or not related to Brazilian familial hemiplegic migraine"
https://pharos.nih.gov/idg/targets/O00555,O00555,17020933,"We found that SCA6 channels have decreased activity-dependent inactivation and a depolarizing shift (+6 mV) in steady-state inactivation properties consistent with a gain of function."
https://pharos.nih.gov/idg/targets/O00555,O00555,16595610,"The C-terminal fragment of CACNA1A bears a polyglutamine tract which, when expanded (Q33) as in spinocerebellar ataxia type 6 (SCA6), is toxic to cells."
https://pharos.nih.gov/idg/targets/O00555,O00555,16508934,"Study shows that the CACNA1A gene is probably not involved in migraine with aura."
https://pharos.nih.gov/idg/targets/O00555,O00555,16389595,"Observational study of gene-disease association. (HuGE Navigator)"
https://pharos.nih.gov/idg/targets/O00555,O00555,16373336,"Ca2+-dependent inactivation of Ca(v)2.1 depends on a subplasmalemmal Ca2+ microdomain that is affected by the amplitude of the Ca2+ current and differentially modulated by distinct Ca2+ buffers"
https://pharos.nih.gov/idg/targets/O00555,O00555,16325861,"a patient with early onset, non fluctuating spinocerebellar ataxia carries a novel de novo missense mutation in this gene, p.R1664Q."
https://pharos.nih.gov/idg/targets/O00555,O00555,16306128,"Results indicate that for human P/Q-type Ca(2+) channels with the long-alpha(1A)-subunit isoform, both missense and nonsense episodic ataxia type 2 mutants indeed display prominent dominant-negative effects."
https://pharos.nih.gov/idg/targets/O00555,O00555,16186543,"The authors describe a case of late-onset EA2 associated with the first multiple-base pair insertion in CACNA1A. Molecular expression revealed evidence of impaired calcium channel function."
https://pharos.nih.gov/idg/targets/O00555,O00555,16043807,"In a UK national study, the authors analyzed 15 index cases with typical EA2 and identified two unreported intronic CACNA1A mutations that predict aberrant splicing."
https://pharos.nih.gov/idg/targets/O00555,O00555,15985579,"In addition to altered channel function, the deficiency in protein misfolding and trafficking associated with the CACNA1A C287Y and G293R mutants may contribute to the slowly progressive cerebellar ataxia."
https://pharos.nih.gov/idg/targets/O00555,O00555,15827025,"Mutated in patients with episodic ataxia type 2, suggested involvement outside the cerebellum."
https://pharos.nih.gov/idg/targets/O00555,O00555,15826995,"presence of significant floccular atrophy compared with controls in both ataxin-2 and Ca(V)2.1 mutations"
https://pharos.nih.gov/idg/targets/O00555,O00555,15795222,"most prevalent mutation, a threonine to methionine substitution at position 666, affects both ionic current and gating current associated with channel activation"
https://pharos.nih.gov/idg/targets/O00555,O00555,15743764,"The unique combination of a particularly slow inactivation of mutant S218L CaV2.1 channel during cortical spreading depression and a somewhat low threshold of channel activation might lead to delayed severe cerebral edema and coma after minor head trauma."
https://pharos.nih.gov/idg/targets/O00555,O00555,15710862,"This study have identified 2 novel truncating mutations of CACNA1A that are associated with interictal dystonia."
https://pharos.nih.gov/idg/targets/O00555,O00555,15545010,"Leaner mice carry a homozygous, autosomal recessive mutation in the CACNA1A gene encoding the Alpha1A subunit of P/Q-type calcium channels. Leaner cerebellar granule cells die via an apoptotic process and the peak time of neuronal death is P20."
https://pharos.nih.gov/idg/targets/O00555,O00555,15504897,"We show that the b gating mode produces reversible uncoupling of inactivation in human CaV2.1 channels."
https://pharos.nih.gov/idg/targets/O00555,O00555,15504896,"Here, we report the characterization of two modes of gating of human CaV2.1 channels, the slow mode and the fast mode."
https://pharos.nih.gov/idg/targets/O00555,O00555,15474358,"Impaired function of the mutant Ca2+ channels rendered them unable to prevent cell death."
https://pharos.nih.gov/idg/targets/O00555,O00555,15452324,"A heterozygous nt 5404 T>C substitution in exon 33 was associated with co-occurrence of familial hemiplegic migraine and childhood epilepsy."
https://pharos.nih.gov/idg/targets/O00555,O00555,15448138,"Familial hemiplegic migraine type 1 mutations K1336E, W1684R, and V1696I alter Cav2.1 Ca2+ channel gating: evidence for beta-subunit isoform-specific effects."
https://pharos.nih.gov/idg/targets/O00555,O00555,15362569,"Observational study of gene-disease association. (HuGE Navigator)"
https://pharos.nih.gov/idg/targets/O00555,O00555,15293273,"This paper identified a novel H1736L missense mutation in the CACNA1A gene associated with the EA2 phenotype. This mutation is localized near the pore-forming region of the P/Q-type Ca2+ channel."
https://pharos.nih.gov/idg/targets/O00555,O00555,15254089,"Concerted splicing of the P/Q channel's main alpha1A subunit, at both an EF-hand-like domain and the channel C terminus, controls the form of Ca2+-dependent facilitation, an activity-dependent enhancement of channel opening triggered by calmodulin."
https://pharos.nih.gov/idg/targets/O00555,O00555,15240985,"This study identified a novel mutation of the CACNA1A gene, Ile1710thr, located in the domain IV-s5."
https://pharos.nih.gov/idg/targets/O00555,O00555,15223312,"The molecular architecture of CAG repeats in mutant SCA6 transcripts was studied."
https://pharos.nih.gov/idg/targets/O00555,O00555,15210532,"CACNA1A gene is not associated with the more common migraine syndromes and is not one of the most common hemiplegic migraine genes."
https://pharos.nih.gov/idg/targets/O00555,O00555,15026782,"These results strongly suggest that ADCA families can be traced back to common ancestors in particular parts of the Netherlands."
https://pharos.nih.gov/idg/targets/O00555,O00555,15026160,"Distribution of CACNA1A haplotypes predisposing to spinocerebellar ataxia type 6 contributes to the geographical differences in prevalence of SCA6 in western Japan."
https://pharos.nih.gov/idg/targets/O00555,O00555,15003170,"Functional analysis of a knockin mouse model of human R192Q pure FHM-1 mutation reveals a pure gain-of-function effect on Ca+ channel current, neurotransmission, and cortical spreading depression."
https://pharos.nih.gov/idg/targets/O00555,O00555,14756671,"Observational study of gene-disease association. (HuGE Navigator)"
https://pharos.nih.gov/idg/targets/O00555,O00555,14681882,"Early cerebellar dysfunction in episodic ataxia type 2 results from the intrinsically abnormal properties of the CACNA1A channel rather than a degenerative process."
https://pharos.nih.gov/idg/targets/O00555,O00555,14592859,"This study found that patients with congenital presynaptic failure of neuromuscle transmission and found sililarities with patients withEA-2 due to mutation in cacna1a."
https://pharos.nih.gov/idg/targets/O00555,O00555,14534930,"We report on a family with ataxia type 6 (SCA6) showing peculiar oculomotor symptoms.  They carried the identical mutation (the number of expanded CAG repeat, 24) in the CACNA1A gene."
https://pharos.nih.gov/idg/targets/O00555,O00555,14530926,"novel CACNA1A mutation, IVS36-2A>G, at the 3' acceptor splice site of intron 36 was identified by sequencing."
https://pharos.nih.gov/idg/targets/O00555,O00555,12756131,"The T666M mutation is the most frequent CACNA1A mutation in familial hemiplegic migraine"
https://pharos.nih.gov/idg/targets/O00555,O00555,12736095,"A novel insertion mutation of acetazolamide-responsive episodic ataxia in a Japanese family."
https://pharos.nih.gov/idg/targets/O00555,O00555,12676347,"CACNA1A expressed in embryonic kidney 293T cells produces a 75 kDa C-terminal fragment in which resistance to proteolysis is rendered by an expanded polyglutamine tract, giving it a key role in the pathological mechanism of spinocerebellar ataxia type 6."
https://pharos.nih.gov/idg/targets/O00555,O00555,12545428,"Observational study of gene-disease association. (HuGE Navigator)"
https://pharos.nih.gov/idg/targets/O00555,O00555,12545428,"Trinucleotide repeat expansions in this protein are not as common in spinocerebellar ataxia as in SSCA8."
https://pharos.nih.gov/idg/targets/O00555,O00555,12542511,"Machado-Joseph disease and dentatorubral-pallidoluysian atrophy (DRPLA) mutations; SCA6 mutation was most frequently detected."
https://pharos.nih.gov/idg/targets/O00555,O00555,12527722,"R192Q mutation reduces G-protein inhibition of P/Q-type Ca(2+) channels, probably by altering mechanisms by which Gbetagamma subunit binding induces change in channel gating. May contribute to migraine attacks."
https://pharos.nih.gov/idg/targets/O00555,O00555,12461694,"novel SNPs within 25 kb of exon 8, defining the critical region of CACNA1A in predisposing to idiopathic generalized epilepsy"
https://pharos.nih.gov/idg/targets/O00555,O00555,12235360,"uncovered two functional effects common to all familial hemiplegic migraine mutations analyzed: increase of single-channel Ca(2+) influx and decrease of maximal Ca(V)2.1 current density in neurons"
https://pharos.nih.gov/idg/targets/O00555,O00555,12056940,"Observational study of gene-disease association. (HuGE Navigator)"
https://pharos.nih.gov/idg/targets/O00555,O00555,12049805,"Observational study of gene-disease association. (HuGE Navigator)"
https://pharos.nih.gov/idg/targets/O00555,O00555,11971066,"first report confirming mutation in CACNA1A gene in familial hemiplegic migraine cases in Japan"
https://pharos.nih.gov/idg/targets/O00555,O00555,11960817,"missense and mutations involved in episodic ataxia type 2"
https://pharos.nih.gov/idg/targets/O00555,O00555,11843866,"Observational study of gene-disease association. (HuGE Navigator)"
https://pharos.nih.gov/idg/targets/O00555,O00555,11804332,"Observational study of genotype prevalence. (HuGE Navigator)"
https://pharos.nih.gov/idg/targets/O00555,O00555,11803518,"Observational study of gene-disease association. (HuGE Navigator)"
https://pharos.nih.gov/idg/targets/O00555,O00555,11803518,"Did not detect any linkage or association in these groups and conclude that if CACNA1A plays a role in typical migraine, it does not confer a major effect on the disease."
https://pharos.nih.gov/idg/targets/O00555,O00555,11742003,"a pronounced loss of P/Q-type Ca(2+) channel function underlies the pathophysiology of EA-2 and PA. In contrast to other EA-2 mutations, AY1593/1594D and G293R form at least partially functional channels"
https://pharos.nih.gov/idg/targets/O00555,O00555,11320173,"Observational study of gene-disease association. (HuGE Navigator)"
https://pharos.nih.gov/idg/targets/Q00975,Q00975,28127114,"CACNA1B protein expressions in tumorous tissues were correlated with NSCLC patients' clinical characteristics and overall survival. CACNA1B mRNA and protein expression levels were higher in NSCLC tumorous tissues than in nontumorous tissues."
https://pharos.nih.gov/idg/targets/Q00975,Q00975,26511252,"AP-1 binding motifs, present only in exon 37a, enhance intracellular trafficking of exon 37a-containing Ca(V)2.2 to the axons and plasma membrane of rat dorsal root ganglia neurons"
https://pharos.nih.gov/idg/targets/Q00975,Q00975,26507659,"the consensus motifs of S-nitrosylation were much more abundant in Cav2.2 than in Cav1.2 and Cav2.1."
https://pharos.nih.gov/idg/targets/Q00975,Q00975,26218636,"The first disease connection for Cav2.2 channels [review]"
https://pharos.nih.gov/idg/targets/Q00975,Q00975,26157024,"These results do not support a causal association between the CACNA1B c.4166G>A; (p.R1389H) variant and M-D."
https://pharos.nih.gov/idg/targets/Q00975,Q00975,25296916,"CACNA1B mutation is linked to unique myoclonus-dystonia syndrome."
https://pharos.nih.gov/idg/targets/Q00975,Q00975,25225550,"with membrane-localized CaV beta subunits, CaV2.2 channels are subject to Gbetagamma-mediated voltage-dependent inhibition, whereas cytosol-localized beta subunits confer more effective PIP2-mediated voltage-independent regulation"
https://pharos.nih.gov/idg/targets/Q00975,Q00975,24566975,"The interaction between LC1 and the N-type channel (CaV2.2 channel) was demonstrated."
https://pharos.nih.gov/idg/targets/Q00975,Q00975,22613715,"Results show that GABA(B) receptors R1 and R2 must be activated for the modulation of N-type (Ca(v)2.2) calcium channels by analgesic alpha-conotoxins Vc1.1 and RgIA."
https://pharos.nih.gov/idg/targets/Q00975,Q00975,22590648,"new mechanistic perspectives, and reveal unexpected variations in determinants, underlying inhibition of Ca(V)1.2/Ca(V)2.2 channels by distinct RGK GTPases."
https://pharos.nih.gov/idg/targets/Q00975,Q00975,22491326,"Ca(2+) exits the channel through the Cav2.2."
https://pharos.nih.gov/idg/targets/Q00975,Q00975,21166801,"polymorphisms and haplotypes in the human CACNA1B gene show significant differences between cerebral infarction and control patients"
https://pharos.nih.gov/idg/targets/Q00975,Q00975,21057379,"Observational study and genome-wide association study of gene-disease association. (HuGE Navigator)"
https://pharos.nih.gov/idg/targets/Q00975,Q00975,20489179,"Observational study and genome-wide association study of gene-disease association. (HuGE Navigator)"
https://pharos.nih.gov/idg/targets/Q00975,Q00975,20379614,"Clinical trial of gene-disease association and gene-environment interaction. (HuGE Navigator)"
https://pharos.nih.gov/idg/targets/Q00975,Q00975,19065143,"Observational study and genome-wide association study of gene-disease association. (HuGE Navigator)"
https://pharos.nih.gov/idg/targets/Q00975,Q00975,18958281,"The orientation of the Ca(v)beta subunit relative to the alpha(1)2.2 subunit is critical, and suggests additional points of contact between these subunits are required for Ca(v)beta to regulate channel activity."
https://pharos.nih.gov/idg/targets/Q00975,Q00975,16857708,"Our studies of the e37a/e37b splice site reveal a multifunctional domain in the C-terminus of Ca(V)2.2 that regulates the overall activity of N-type calcium channels in nociceptors."
https://pharos.nih.gov/idg/targets/Q00975,Q00975,16627564,"The Y388S mutation had no effect on current density and cell surface expression of Ca(V)2.2/alpha2delta-2/beta1b channels expressed in human embryonic kidney tsA-201 cells, when equivalent proportions of cDNA were used."
https://pharos.nih.gov/idg/targets/Q00975,Q00975,15607937,"Activation of PKC resulted in its recruitment to and phosphorylation of Ca(V)2.2 channels, but PKC phosphorylation did not dissociate Ca(V)2.2 channel/syntaxin 1A complexes."
https://pharos.nih.gov/idg/targets/Q00975,Q00975,15166237,"Cav2.2 alpha2delta auxiliary subunit binds to omega-conotoxins"
https://pharos.nih.gov/idg/targets/Q00975,Q00975,14602720,"the C-terminal region of Ca(v)2.2 does not have a critical role in regulation of the calcium channel"
https://pharos.nih.gov/idg/targets/Q00975,Q00975,12414690,"molecular dissection of calcium current mechanosensitivity- electrophysiology of N-type calcium channels"
https://pharos.nih.gov/idg/targets/Q00975,Q00975,12018859,"Results suggest that a 39 bp DNA element in the N-type voltage-gated calcium channel alpha1B gene might act as repressor in non-neuronal cells through specific interactions with DNA."
https://pharos.nih.gov/idg/targets/Q9P0X4,Q9P0X4,28972185,"human Cav3.1, Cav3.2, and Cav3.3 T-type channels specifically associate with CaM at helix 2 of the gating brake in the I-II linker of the channels."
https://pharos.nih.gov/idg/targets/Q9P0X4,Q9P0X4,28846697,"In gastric cancer, expression of all the CACNA (1G, 1H, 1I) genes was associated with overall survival (OS) among stage I-IV patients. By combining the three potential biomarkers, a TTCC signature was developed, which retained a significant association with OS both in stage IV and stage I-III patients. Alterations in CACNA gene expression are linked to tumour prognosis."
https://pharos.nih.gov/idg/targets/Q9P0X4,Q9P0X4,28725167,"significant association exists between the CACNA1I gene and schizophrenia in the Uighur Chinese population"
https://pharos.nih.gov/idg/targets/Q9P0X4,Q9P0X4,28165634,"CACNA1I variant is associated with differential antiepileptic drug response in childhood absence epilepsy."
https://pharos.nih.gov/idg/targets/Q9P0X4,Q9P0X4,26488564,"CaV3.1, CaV3.2 and CaV3.3 channels, are best recognized for their negative voltage of activation and inactivation thresholds that allow them to operate near the resting membrane potential of neurons."
https://pharos.nih.gov/idg/targets/Q9P0X4,Q9P0X4,25454347,"Extracellular pressure increases [Ca(2+)]i via Cav3.3, driving a PKC-beta- IKK- IkB-NF-kB pathway that stimulates cancer cell proliferation"
https://pharos.nih.gov/idg/targets/Q9P0X4,Q9P0X4,23488970,"Ethanol primarily affects the CaV3.2 isoform of T-type Ca(2)+ channels, acting through protein kinase C."
https://pharos.nih.gov/idg/targets/Q9P0X4,Q9P0X4,18591418,"The sodium channel toxins tetrodotoxin and saxitoxin interact with the alpha-subunit of T-type Ca 2+ channels."
https://pharos.nih.gov/idg/targets/Q9P0X4,Q9P0X4,17535809,"two distinct regions of the Cav3.3 channel are necessary and sufficient for complete M1 receptor-mediated channel inhibition"
https://pharos.nih.gov/idg/targets/Q9P0X4,Q9P0X4,16939858,"Observational study of gene-disease association. (HuGE Navigator)"
https://pharos.nih.gov/idg/targets/Q9P0X4,Q9P0X4,16740636,"CatSper1 and CatSper2 can associate with and modulate the function of the Ca(v)3.3 channel, which might be important in the regulation of sperm function."
https://pharos.nih.gov/idg/targets/Q9P0X4,Q9P0X4,15254077,"intracellular regions after repeats I and IV play a role in gating interdependently, suggesting a direct interaction, and splice variation of Cav3.3 channels provides a mechanism for fine-tuning latency and duration of low-threshold spikes."
https://pharos.nih.gov/idg/targets/Q9P0X4,Q9P0X4,11927664,"Specific contribution of human T-type calcium channel isotypes (alpha(1G), alpha(1H) and alpha(1I)) to neuronal excitability."
https://pharos.nih.gov/idg/targets/Q13936,Q13936,28792954,"CACNA1C variants for psychiatric disorders were found to be associated with long sleep latency among 8-month-old infants."
https://pharos.nih.gov/idg/targets/Q13936,Q13936,28552773,"BIMU8 is a potent blocker of hERG, NaV1.5 and CaV1.2 cardiac ion channels, inducing cardiac arrhythmias."
https://pharos.nih.gov/idg/targets/Q13936,Q13936,28493952,"the loss-of-function CACNA1C-Q1916R mutation contributed to Early repolarization syndrome-related sudden cardiac death."
https://pharos.nih.gov/idg/targets/Q13936,Q13936,28481223,"In type 2 diabtes beta cells, exocytosis was slower and not synchronized with membrane depolarizations, and neither Ca2+ influx nor CaV1.2 was concentrated at insulin granules."
https://pharos.nih.gov/idg/targets/Q13936,Q13936,28427417,"Targeted sequencing revealed trigenic mutations: c.700G>A/p.E234K in DES, c.2966G>A/p.R989H in MYPN, and c.5918G>C/p.R1973P in CACNA1C in a family of hypertrophic cardiomyopathy with early repolarization and short QT syndrome."
https://pharos.nih.gov/idg/targets/Q13936,Q13936,28398341,"Carriers of the CACNA1C allele A exhibited greater left mOFC thickness compared to non-carriers. Moreover, CACNA1C A carriers showed age-related cortical thinning of the left cACC, whereas among A non-carriers there was not an effect of age on left cACC cortical thinning."
https://pharos.nih.gov/idg/targets/Q13936,Q13936,28119464,"Data indicate a subpopulation of the CaV1.2 channel pore-forming subunit (alpha1C) within nanometer proximity of protein kinase A (PKA) at the sarcolemma of murine and human arterial myocytes."
https://pharos.nih.gov/idg/targets/Q13936,Q13936,27893184,"CACNA1C rs1006737 SNP and SNPs in linkage disequilibrium with it may influence the risk of QTc prolongation in patients treated with psychotropic drugs with cardiovascular risk"
https://pharos.nih.gov/idg/targets/Q13936,Q13936,27868338,"We report the case of female child with a history of surgery for syndactyly of the hands and feet, Despite the absence of facial dysmorphism and the presence of normal psychomotor development, a diagnosis of Timothy syndrome was made given association of syndactyly and the ECG features. Sanger sequencing of the CACNA1C gene, followed by sequencing of the genes KCNQ1, KCNH2, KCNE1, KCNE2, were negative."
https://pharos.nih.gov/idg/targets/Q13936,Q13936,27790829,"Authors assessed the effect across the human brain of the CACNA1C rs1006737 genotype on FA, in a Caucasian clinical sample as well as in health, and whether this genotype effect was different between diagnostic groups and whether it interacted with the ZNF804A rs1344706 genotype."
https://pharos.nih.gov/idg/targets/Q13936,Q13936,27744593,"The Ca channel alpha 1C (CACNA1C) mRNA and protein expressions were noticeably elevated in H-Cd group. These findings suggest that CACNA1C might be implicated in Cd transport in human placenta."
https://pharos.nih.gov/idg/targets/Q13936,Q13936,27620326,"The frequency of CACNA1C rs10848683 in genetic high-risk individuals was double that in controls. For SYNE1 rs214950, higher frequencies were found in the genetic high-risk group than in controls. Polymorphisms in CACNA1C and SYNE1 could confer a greater risk of developing Schizophrenia and Bipolar Disorder in individuals who are already at high risk because of their family history."
https://pharos.nih.gov/idg/targets/Q13936,Q13936,27529678,"Top association findings suggested that the bipolar disorder risk allele at SNP rs4765913 in CACNA1C gene may be associated with increased risk of cardiac dysrhythmias."
https://pharos.nih.gov/idg/targets/Q13936,Q13936,27341015,"Authors validated CACNA1C to be the direct target gene of miR-29a-3p, and also established the negative regulatory relationship between miR-29a-3p and CACNA1C via studying the relative luciferase activity."
https://pharos.nih.gov/idg/targets/Q13936,Q13936,27276213,"Functional Characterization of Schizophrenia-Associated Variation in CACNA1C"
https://pharos.nih.gov/idg/targets/Q13936,Q13936,27260792,"Rs1006737 showed significant association with Major Depressive Disorder (MDD) in the fixed-effect model (Z = 2.56, P = 0.011, OR = 1.08, 95%CI = 1.04-1.12) and the association remained after reanalyzing the data according to ethnicity. We found that two SNPs, rs4765905 and rs4765937 showed nominal association with MDD, while rs2239073 exhibited significant association with MDD."
https://pharos.nih.gov/idg/targets/Q13936,Q13936,27221213,"No significant associations (regardless of correction for multiple testing) between the BDNF and CACNA1C risk variants and cognitive functioning were found in either patients or controls."
https://pharos.nih.gov/idg/targets/Q13936,Q13936,27218670,"Rare CACNA1C genetic variants may contribute to the underlying pathogenic basis for some cases of sudden explaned dealth in the young in either a gain or loss-of-function mechanism."
https://pharos.nih.gov/idg/targets/Q13936,Q13936,27124316,"SNPs associated with diabetic cataract"
https://pharos.nih.gov/idg/targets/Q13936,Q13936,26756527,"the association of rs1006737 with gray matter volume in a sample of 278 healthy Han Chinese, was examined."
https://pharos.nih.gov/idg/targets/Q13936,Q13936,26750869,"the function of purified human Cav1.2 in proteoliposomes, was investigated."
https://pharos.nih.gov/idg/targets/Q13936,Q13936,26611642,"CACNA1C risk variant affects facial emotion recognition in healthy individuals."
https://pharos.nih.gov/idg/targets/Q13936,Q13936,26553695,"This integrative genomic study confirmed the role of RUNX2 as a potential driver of AS and identified a new AS susceptibility gene, CACNA1C, belonging to the calcium signaling pathway."
https://pharos.nih.gov/idg/targets/Q13936,Q13936,26541689,"The linking variation in the CACNA1C gene is a neurochemical marker of neuroaxonal plasticity in those with bipolar disorder."
https://pharos.nih.gov/idg/targets/Q13936,Q13936,26525885,"Single nucleotide polymorphism in an intron of the CACNA1C gene conveyed an increased risk for developing Bipolar disorder."
https://pharos.nih.gov/idg/targets/Q13936,Q13936,26509803,"Study suggests initial support for a link between bipolar disorder risk SNPs rs472913 (1p32.1) and rs1006737 (CACNA1C) and brain arousal regulation"
https://pharos.nih.gov/idg/targets/Q13936,Q13936,26507659,"the consensus motifs of S-nitrosylation were much more abundant in Cav2.2 than in Cav1.2 and Cav2.1."
https://pharos.nih.gov/idg/targets/Q13936,Q13936,26476274,"CACNA1C modulates the cellular rhythm amplitude response to lithium, providing a specific link between LTCCs and circadian rhythms in the context of Bipolar disorder and lithium"
https://pharos.nih.gov/idg/targets/Q13936,Q13936,26475575,"The associations of CACNA1C rs10774035 with outcome in schizophrenia-spectrum and non-association with outcome in bipolar disorders"
https://pharos.nih.gov/idg/targets/Q13936,Q13936,26406417,"Copy number increase of CACNA1C are associated with esophageal squamous cell carcinoma."
