"URL","Uniprot ID","PMID","Abstract"
https://pharos.nih.gov/idg/targets/Q12809,Q12809,21669058,"Studies suggest hERG1 K(+) channels as a therapeutic target for leukemia treatment and prevention."
https://pharos.nih.gov/idg/targets/Q12809,Q12809,21573751,"WT hERG was observed in the cytosol and at the plasma membrane. G601S was detected in the cytosol only. The average D1 diffusion for G601S was more than two-fold higher than that of the WT hERG, probably due to incomplete glycosylation of G601S."
https://pharos.nih.gov/idg/targets/Q12809,Q12809,21536683,"Protein kinase A activity at the endoplasmic reticulum surface is responsible for augmentation of human ether-a-go-go-related gene product (HERG)"
https://pharos.nih.gov/idg/targets/Q12809,Q12809,21536673,"a putative \"gating face\" in the PAS domain where mutations within this region form functional channels with altered gating properties"
https://pharos.nih.gov/idg/targets/Q12809,Q12809,21525004,"the effect of progesterone on the expression, trafficking, and function of HERG channels and the underlying mechanism"
https://pharos.nih.gov/idg/targets/Q12809,Q12809,21496174,"Congenital LQTS genes revealed a heterozygous carrier of a novel KCNH2 mutation, c.G238C. The pathogenicity of this mutation, displayed a 2-fold reduction in protein expression and current density due to a maturation/trafficking-deficient mechanism."
https://pharos.nih.gov/idg/targets/Q12809,Q12809,21490315,"study concludes that the trafficking of G601S-hERG is negatively regulated by a microtubule-dependent compartment within the endoplasmic reticulum"
https://pharos.nih.gov/idg/targets/Q12809,Q12809,21489024,"Conditions leading to localized extracellular acidosis may facilitate heterogeneity of action of dofetilide and flecainide, but not amiodarone via modification of hERG channel blockade."
https://pharos.nih.gov/idg/targets/Q12809,Q12809,21483829,"Study demonstrates a novel dominant-negative Kv11.1 mutation, which results in degraded non-functional channels leading to a LQT2 phenotype."
https://pharos.nih.gov/idg/targets/Q12809,Q12809,21474444,"physical interactions between the N-terminal-most segment of the N terminus and the S4-S5 linker constitute an essential component of the hERG gating machinery"
https://pharos.nih.gov/idg/targets/Q12809,Q12809,21463633,"ubiquitylation of hERG1 by the ubiquitin ligase Nedd4-2 is a potentially constitutive physiological mechanism for the regulation of hERG1 channel membrane density and it contributes to the regulation of cardiac repolarization"
https://pharos.nih.gov/idg/targets/Q12809,Q12809,21440677,"Men and women with type 2 long QT syndrome exhibit time-dependent differences in the risk for cardiac events. The probability of life-threatening cardiac events years was higher among LQT2 women (26%)compared to men (14%; P <.001) with KCNH2 mutation."
https://pharos.nih.gov/idg/targets/Q12809,Q12809,21376840,"The major mechanism underlying pathogenicity of the R582C mutation is a trafficking deficiency, perhaps reflecting the position of the mutation in the pore turret."
https://pharos.nih.gov/idg/targets/Q12809,Q12809,21357734,"suggest that the mechanism for regulation of slow deactivation in hERG channels is an interaction between the N-terminal PAS domain and the C-terminal cyclic nucleotide-binding domain ."
https://pharos.nih.gov/idg/targets/Q12809,Q12809,21320466,"Data suggest that to avoid the potential harmful side effect, hERG channel toxicity needs to be assessed in a timely and efficient fashion."
https://pharos.nih.gov/idg/targets/Q12809,Q12809,21315844,"the phenotypic expression of KCNH2 mutations and the effect of IKr-inhibitory drug on the surface electrocardiogram are specific."
https://pharos.nih.gov/idg/targets/Q12809,Q12809,21234558,"tissue-level electrophysiological effects of any hERG mutations"
https://pharos.nih.gov/idg/targets/Q12809,Q12809,21219869,"effects of acidosis on hERG channels incorporating the hERG1b isoform and demonstrate that hERG1b exhibits greater sensitivity to inhibition by extracellular acidosis than does the hERG1a isoform were reported."
https://pharos.nih.gov/idg/targets/Q12809,Q12809,21185499,"CNVs in KCNQ1 and KCNH2 explain around 3% of LQTS in patients with no point mutation in these genes."
https://pharos.nih.gov/idg/targets/Q12809,Q12809,21177251,"monoubiquitin dynamically mediates endocytic degradation of mature hERG channels under low K(+) conditions."
https://pharos.nih.gov/idg/targets/Q12809,Q12809,21170050,"Closure of the selectivity filter gate in the human K(v)11.1 K(+) channel is initiated by K(+) exit, followed in sequence by conformational rearrangements of the pore domain."
https://pharos.nih.gov/idg/targets/Q12809,Q12809,21164565,"Patient with a loss-of-function mutation in KCNQ1 and a loss-of-function polymorphism in KCNH2 is reported. Results suggest that a reduction of both IKr and IKs underlies the combined LQT1 and LQT2 phenotype."
https://pharos.nih.gov/idg/targets/Q12809,Q12809,21135701,"In transgenic long QT syndrome rabbits, Kv11.1 channel activation shortens the cardiac activation potential duration."
https://pharos.nih.gov/idg/targets/Q12809,Q12809,21135103,"Mechanistic insight into human ether-a-go-go-related gene (hERG) K+ channel deactivation gating from the solution structure of the EAG domain."
https://pharos.nih.gov/idg/targets/Q12809,Q12809,21130771,"The altered function of T618I-HERG channels suggests that this mutation in the KCNH2 gene is responsible for the SQTS phenotype in this family."
https://pharos.nih.gov/idg/targets/Q12809,Q12809,21109023,"Characterized a LQT2-associated missense mutation. Results obtained demonstrate the importance of the glutamic acid at position 637 for the inactivation process and K+ selectivity of Kv11.1 channels."
https://pharos.nih.gov/idg/targets/Q12809,Q12809,21070882,"Observational study of gene-disease association. (HuGE Navigator)"
https://pharos.nih.gov/idg/targets/Q12809,Q12809,21063774,"Genetic characteristics associated with response to domperidone therapy included polymorphisms in the drug transporter gene ABCB1, the potassium channel KCNH2 gene, and alpha1D--adrenoceptor ADRA1D gene."
https://pharos.nih.gov/idg/targets/Q12809,Q12809,21063774,"Observational study of gene-disease association and gene-environment interaction. (HuGE Navigator)"
https://pharos.nih.gov/idg/targets/Q12809,Q12809,21063070,"Observational study of genetic testing. (HuGE Navigator)"
https://pharos.nih.gov/idg/targets/Q12809,Q12809,21057041,"2592+1G>A causes multiple splicing defects, consistent with the pathogenic mechanisms of long QT syndrome"
https://pharos.nih.gov/idg/targets/Q12809,Q12809,21055387,"The solution structure of hERG NTD was obtained and the N-terminal residues 13-23 forming an amphipathic helix which may be important for the protein-protein or protein-membrane interactions."
https://pharos.nih.gov/idg/targets/Q12809,Q12809,21048156,"Data show that coculture of ALL cells with MSCs induced on the lymphoblast plasma membrane the expression of a signaling complex formed by hERG1, the beta(1)-integrin subunit, and the chemokine receptor CXCR4."
https://pharos.nih.gov/idg/targets/Q12809,Q12809,21044581,"Substitution of G546 with residues possessing different physicochemical properties shifted activation gating by approximately -50 mV (with the exception of G546C)."
https://pharos.nih.gov/idg/targets/Q12809,Q12809,20947828,"hERG overexpression dramatically accelerates reentry frequency in neonatal rat ventricular myocyte monolayers"
https://pharos.nih.gov/idg/targets/Q12809,Q12809,20931094,"The hERG-associated missense mutation G572R, like most LQT2 missense mutations, generates a trafficking-deficient phenotype."
https://pharos.nih.gov/idg/targets/Q12809,Q12809,20920651,"large gene rearrangements in the LQT2-susceptibility gene KCNH2 may serve as a pathogenic basis for cases of seemingly genotype-negative LQTS."
https://pharos.nih.gov/idg/targets/Q12809,Q12809,20920651,"Observational study of gene-disease association. (HuGE Navigator)"
https://pharos.nih.gov/idg/targets/Q12809,Q12809,20876384,"A novel binding site is determined in hERG1 channel by scanning mutagenesis, molecular modeling, and activation of hERG1 channel."
https://pharos.nih.gov/idg/targets/Q12809,Q12809,20875080,"KCNH2 Arg176Trp and SCN5A Pro1090Leu were identified once in Sudden unexpected death in epilepsy cases and absent in control alleles"
https://pharos.nih.gov/idg/targets/Q12809,Q12809,20875080,"Observational study of gene-disease association. (HuGE Navigator)"
https://pharos.nih.gov/idg/targets/Q12809,Q12809,20860824,"up-regulation of hERG1 channels and of the VEGF-A pathway has a role in retinoblastoma resistance to treatment"
https://pharos.nih.gov/idg/targets/Q12809,Q12809,20855658,"Observational study of gene-disease association. (HuGE Navigator)"
https://pharos.nih.gov/idg/targets/Q12809,Q12809,20851114,"Observational study of genetic testing. (HuGE Navigator)"
https://pharos.nih.gov/idg/targets/Q12809,Q12809,20833965,"Pore mutants of HERG and KvLQT1 downregulate the reciprocal currents in stable cell lines."
https://pharos.nih.gov/idg/targets/Q12809,Q12809,20831043,"Observational study of gene-disease association. (HuGE Navigator)"
https://pharos.nih.gov/idg/targets/Q12809,Q12809,20712994,"The sensitivity of hERG to Phosphatidylinositol-4,5-bisphosphate (PIP(2)) comes close to that of KCNE1-KCNQ1 channels, which lies in the range of physiological PIP(2) variations."
https://pharos.nih.gov/idg/targets/Q12809,Q12809,20699637,"[REVIEW] subset of DnaJ co-chaperones (i.e. DnaJA1, DnaJA2 and DnaJA4) act in concert with Hsc70, (the constitutive heat shock cognate protein of 70 kDa), to regulate the maturation and trafficking of hERG potassium channels"
https://pharos.nih.gov/idg/targets/Q12809,Q12809,20693282,"Data suggest that post-transcriptional regulation of hERG1 pre-mRNA may represent a novel mechanism to modulate the expression and function of hERG1 channels."
https://pharos.nih.gov/idg/targets/Q12809,Q12809,20662825,"Our data suggest that antofloxacin only causes a minor reduction of I(HERG/MiRP1) at the estimated free plasma level."
https://pharos.nih.gov/idg/targets/Q12809,Q12809,20660661,"New Markov models of hERG1 channels were developed that describe gating currents as a noncooperative two-phase process of the VSD and can account for changes in these currents caused by extracellular Cd(2+)."
https://pharos.nih.gov/idg/targets/Q12809,Q12809,20628086,"Observational study of gene-disease association, gene-environment interaction, and pharmacogenomic / toxicogenomic. (HuGE Navigator)"
https://pharos.nih.gov/idg/targets/Q12809,Q12809,20605793,"Overexpression of Cav1 accelerated internalization of mature hERG channels in 0 mM K(+)(o), whereas knockdown of Cav1 impeded this process."
https://pharos.nih.gov/idg/targets/Q12809,Q12809,20574821,"changes in the relative expression level of the isoforms may have significant physiological consequences by modulation of tissue excitability.[review]"
https://pharos.nih.gov/idg/targets/Q12809,Q12809,20549940,"Physical and functional interaction between integrins and hERG1 channels in cancer cells."
https://pharos.nih.gov/idg/targets/Q12809,Q12809,20547678,"Cysteine 723 (C723), a conserved residue in a structural element linking the C-terminal domain to the channel's gate, is critical for oxidative functional modification of hERG1 channels."
https://pharos.nih.gov/idg/targets/Q12809,Q12809,20544339,"Mutations in KCNH2 are a common cause of long QT syndrome. Most mutations cause loss of channel function by causing the subunits to misfold and/or decrease their trafficking to the plasma membrane[review]"
https://pharos.nih.gov/idg/targets/Q12809,Q12809,20541041,"Observational study of gene-disease association and gene-gene interaction. (HuGE Navigator)"
https://pharos.nih.gov/idg/targets/Q12809,Q12809,20507645,"the potassium channel gene HERG1 is related to schizophrenia"
https://pharos.nih.gov/idg/targets/Q12809,Q12809,20507645,"Observational study of gene-disease association. (HuGE Navigator)"
https://pharos.nih.gov/idg/targets/Q12809,Q12809,20479154,"Gene therapy with KCNH2-G628S eliminated AF by prolonging atrial action potential duration. The effect duration correlated with transgene expression."
https://pharos.nih.gov/idg/targets/Q12809,Q12809,20470906,"REM-related changes in cardiac activation and ventricular repolarization may be implicated in sleep-related malignant arrhythmias in women with the LQT2 genotype(KCNH2 mutation)"
https://pharos.nih.gov/idg/targets/Q12809,Q12809,20470906,"Observational study of gene-disease association. (HuGE Navigator)"
https://pharos.nih.gov/idg/targets/Q12809,Q12809,20465523,"The machine learning model in this review has been developed to predict binding to the ether-a-go-go related gene (hERG) ion channel protein, which will greatly reduce the number of toxic compound failures and thus the associated drug development costs."
https://pharos.nih.gov/idg/targets/Q12809,Q12809,20400777,"Observational study of gene-disease association. (HuGE Navigator)"
https://pharos.nih.gov/idg/targets/Q12809,Q12809,20386770,"Observational study of gene-disease association. (HuGE Navigator)"
https://pharos.nih.gov/idg/targets/Q12809,Q12809,20375276,"Ceramide regulates the kinetics of HERG channels via translocation into lipid rafts."
https://pharos.nih.gov/idg/targets/Q12809,Q12809,20363888,"The pH(o) sensitivity of HERG channel activation is dominated by the pH(o) sensitivity of the voltage-insensitive step, in a fashion that is compatible with the presence of at least one proton-binding site on each subunit of the channel tetramer."
https://pharos.nih.gov/idg/targets/Q12809,Q12809,20226272,"Observational study of genetic testing. (HuGE Navigator)"
https://pharos.nih.gov/idg/targets/Q12809,Q12809,20215044,"KCNH2 K897T and rs3807375 has a modest effect on ECG T-wave peak to T-wave end interval but is not related to T-wave morphology measures."
https://pharos.nih.gov/idg/targets/Q12809,Q12809,20215044,"Observational study of gene-disease association. (HuGE Navigator)"
https://pharos.nih.gov/idg/targets/Q12809,Q12809,20144677,"The EGR1 may not play a major role in schizophrenia susceptibility in the Chinese Han population."
https://pharos.nih.gov/idg/targets/Q12809,Q12809,20140874,"A novel frameshift mutation in the KCNH2 gene was identified in the congenital long QT syndrome family."
https://pharos.nih.gov/idg/targets/Q12809,Q12809,20133899,"Study links a gating conformational state with membrane stability of HERG channels and show that extracellular K(+) is a prerequisite for HERG function and membrane stability."
https://pharos.nih.gov/idg/targets/Q12809,Q12809,20126398,"Results suggest that regional differences in the relative abundance of ERG1 isoforms may represent a potential mechanism underlying the heterogeneity of both APD and APD restitution observed in mammalian hearts."
https://pharos.nih.gov/idg/targets/Q12809,Q12809,20116193,"Observational study of gene-disease association. (HuGE Navigator)"
https://pharos.nih.gov/idg/targets/Q12809,Q12809,20108749,"Observational study of gene-disease association. (HuGE Navigator)"
https://pharos.nih.gov/idg/targets/Q12809,Q12809,20097192,"The amiodarone derivative KB130015 activates HERG1 potassium channels via a novel mechanism."
https://pharos.nih.gov/idg/targets/Q12809,Q12809,20071715,"Observational study of gene-disease association. (HuGE Navigator)"
https://pharos.nih.gov/idg/targets/Q12809,Q12809,20004623,"In Tako-tsubo cardiomyopathy, a mutation was found in the gene KCNH2, which encodes hERG1, responsible for the K+ current IKr. The mutation was a novel in-frame duplication of 7 amino acids in the Per-Arnt-Sim (PAS) domain located in the N-terminus."
https://pharos.nih.gov/idg/targets/Q12809,Q12809,19956635,"Uncategorized study of gene-disease association, gene-environment interaction, and pharmacogenomic / toxicogenomic. (HuGE Navigator)"
https://pharos.nih.gov/idg/targets/Q12809,Q12809,19955179,"Data show that toxin VSTx1 produced both blocking effects and changes in the gating, but these latter actions were restricted to hERG1."
https://pharos.nih.gov/idg/targets/Q12809,Q12809,19949665,"Results suggest that Lindera erythrocarpa extract blocks HERG channels, which could contribute to its anticancer and cardiac arrhythmogenic effect."
https://pharos.nih.gov/idg/targets/Q12809,Q12809,19940115,"Hsp40 type 1 chaperones DJA1 (DNAJA1/Hdj2) and DJA2 (DNAJA2) as key modulators of hERG degradation"
https://pharos.nih.gov/idg/targets/Q12809,Q12809,19926013,"Observational study of gene-disease association. (HuGE Navigator)"
https://pharos.nih.gov/idg/targets/Q12809,Q12809,19913121,"Observational study of gene-disease association. (HuGE Navigator)"
https://pharos.nih.gov/idg/targets/Q12809,Q12809,19892732,"Data suggest that direct interaction of PD-118057 with the pore helix attenuates fast P-type inactivation and increases open probability of hERG1 channels."
https://pharos.nih.gov/idg/targets/Q12809,Q12809,19878047,"depolarization results in the accessibility of seven consecutive S4 residues in hERG, including the first two charged residues, K525 and R528, to extracellularly applied reagent"
https://pharos.nih.gov/idg/targets/Q12809,Q12809,19859662,"The HERG protein was found to be located only in early endosomes and not lysosomes and HERG surface expression and function regulated by diglycerides."
https://pharos.nih.gov/idg/targets/Q12809,Q12809,19843919,"When reconstituted in Chinese hamster ovary cells, long-QT syndrome KCNH2 mutant channels showed complex gating defects without dominant negative effects or a relatively mild decreased current density."
https://pharos.nih.gov/idg/targets/Q12809,Q12809,19821083,"Gambogic acid exhibited its anti-leukemia effects partially through down-regulating the expression level of hERG channel in K562 cells."
https://pharos.nih.gov/idg/targets/Q12809,Q12809,19765650,"results showed that HERG was expressed on protein and mRNA levels in MDA-MB-435S melanoma cells."
https://pharos.nih.gov/idg/targets/Q12809,Q12809,19726881,"Cell surface density of HERG is regulated by extracellular K+. Because hypokalemia is known to exacerbate long QT syndrome (LQTS) and Torsades de pointes tachyarrhythmias, findings provide a potential mechanistic link between hypokalemia and LQTS."
https://pharos.nih.gov/idg/targets/Q12809,Q12809,19720020,"In this study, we described the biophysical properties of a rolf-hERG S3-S4 chimera. Our results show that only the activation process is impaired."
https://pharos.nih.gov/idg/targets/Q12809,Q12809,19716085,"The researchers found evidence of KCNH2 mutations in a cohort of patients with long QT syndrome"
https://pharos.nih.gov/idg/targets/Q12809,Q12809,19716085,"Observational study of gene-disease association. (HuGE Navigator)"
https://pharos.nih.gov/idg/targets/Q12809,Q12809,19690348,"Erg1 channels are new mediators of alpha- and beta-cell repolarization. However, antagonism of Erg1 has divergent effects in these cells; to augment glucose-dependent insulin secretion and inhibit low glucose stimulated glucagon secretion."
https://pharos.nih.gov/idg/targets/Q12809,Q12809,19671703,"Results indicate that cyclic nucleotides do not directly modulate mEAG1 and hERG1 channels."
https://pharos.nih.gov/idg/targets/Q12809,Q12809,19668779,"at least one patient carrying the mutation had a history of seizures after auditory stimuli, which is a major trigger for arrhythmic events in LQTS2"
https://pharos.nih.gov/idg/targets/Q12809,Q12809,19654002,"These results demonstrate that ROS generated during hypoxia prevents maturation of the hERG protein by inhibiting Hsp90 interaction resulting in decreased protein expression and currents."
https://pharos.nih.gov/idg/targets/Q12809,Q12809,19617705,"increases in extracellular potassium reduce HERG block by quinidine and cisapride"
https://pharos.nih.gov/idg/targets/Q12809,Q12809,19577877,"HERG1, but not CEA, CK19 or CK20, is a highly sensitive and reliable colorectal tumor biomarker that may constitute a novel molecular target for tumor treatment"
https://pharos.nih.gov/idg/targets/Q12809,Q12809,19551538,"Observational study of gene-disease association. (HuGE Navigator)"
https://pharos.nih.gov/idg/targets/Q12809,Q12809,19501051,"electrophysiological effects were studied of a gain-of-function hERG mutation (N588K; responsible for the 'SQT1' variant of the short QT syndrome) on current (I(hERG1a/1b)) carried by co-expressed hERG1a/1b channels."
https://pharos.nih.gov/idg/targets/Q12809,Q12809,19495974,"hERG1 channel was proved to be a potential biomarker for gastric cancer invasion and survival."
https://pharos.nih.gov/idg/targets/Q12809,Q12809,19490382,"We report a new genetic variation (rs1805120) in the KCNH2 gene that predisposes Chinese Han individuals to the risk of acquired AF. Further genetic studies are required to identify the variants in linkage disequilibrium with this polymorphism."
https://pharos.nih.gov/idg/targets/Q12809,Q12809,19490382,"Observational study of gene-disease association. (HuGE Navigator)"
https://pharos.nih.gov/idg/targets/Q12809,Q12809,19490267,"The glycine584serine hERG mutant channel is the first example of a long-QT-associated missense mutant that has a genuine type IV phenotype, that is, abnormal gating, due to enhanced inactivation."
https://pharos.nih.gov/idg/targets/Q12809,Q12809,19439805,"Changes in the timing of outward I(hERG) transients elicited by premature stimuli following AP (action potential) commands indicate that the SQT1 variant may alter the protection that hERG provides cardiac tissue against premature arrhythmogenic stimuli"
https://pharos.nih.gov/idg/targets/Q12809,Q12809,19424205,"overexpression of KCNH2 isoform 3.1 leads to profound changes in neuronal firing pattern, found in schizophrenics."
https://pharos.nih.gov/idg/targets/Q12809,Q12809,19413965,"it is concluded that interactions between H562 in the S5 helix and amino acids in the pore helix are important determinants of hERG1 potassium channel function, as confirmed by theory and experiment"
https://pharos.nih.gov/idg/targets/Q12809,Q12809,19412172,"Identification of a previously undescribed KCNH2 channel isoform involved in cortical physiology, cognition and psychosis, providing a potential new therapeutic drug target."
https://pharos.nih.gov/idg/targets/Q12809,Q12809,19412172,"Meta-analysis of gene-disease association. (HuGE Navigator)"
https://pharos.nih.gov/idg/targets/Q12809,Q12809,19409379,"Results suggest that hERG1 K(+) channels are functionally linked to cell migration induced by stromal cell-derived factor-1."
https://pharos.nih.gov/idg/targets/Q12809,Q12809,19406877,"The evolutionarily conserved residue A653 plays a key role in HERG channel closing."
https://pharos.nih.gov/idg/targets/Q12809,Q12809,19324319,"Aminoglycoside antibiotics restore functional expression of truncated HERG channels produced by nonsense mutations."
https://pharos.nih.gov/idg/targets/Q12809,Q12809,19322600,"Observational study of gene-disease association. (HuGE Navigator)"
https://pharos.nih.gov/idg/targets/Q12809,Q12809,19305991,"structural features of a peptide from the pore loop region of hERG (residues 600-642) in both sodium dodecyl sulfate (SDS) and dodecyl phosphocholine (DPC) micelles"
https://pharos.nih.gov/idg/targets/Q12809,Q12809,19305409,"Genome-wide association study of gene-disease association. (HuGE Navigator)"
https://pharos.nih.gov/idg/targets/Q12809,Q12809,19305408,"Meta-analysis and genome-wide association study of gene-disease association. (HuGE Navigator)"
https://pharos.nih.gov/idg/targets/Q12809,Q12809,19244476,"State-dependent block of HERG potassium channels by R-roscovitine: implications for cancer therapy."
https://pharos.nih.gov/idg/targets/Q12809,Q12809,19234087,"PKA phosphorylation of HERG protein regulates the rate of channel synthesis."
https://pharos.nih.gov/idg/targets/Q12809,Q12809,19215240,"The results of the present study suggest that the F463L mutation leads to loss of function in HERG through a dominant-negative effect caused by impaired trafficking of the channel."
https://pharos.nih.gov/idg/targets/Q12809,Q12809,19187913,"We identified a novel BP mutation in KCNH2 that disrupts the intron 9 acceptor splice site definition and causes LQT2."
https://pharos.nih.gov/idg/targets/Q12809,Q12809,19174314,"The mutation induced changes in IKr cannot only explain the short QT interval but also the Brugada-type ECG of the patient."
https://pharos.nih.gov/idg/targets/Q12809,Q12809,19172259,"functional role of the large intracellular regions (which include the cyclic nucleotide binding domain, cNBD, and the Per-Arnt-Sim domain, PAS) in the herg channel"
https://pharos.nih.gov/idg/targets/Q12809,Q12809,19160088,"Observational study of gene-disease association. (HuGE Navigator)"
https://pharos.nih.gov/idg/targets/Q12809,Q12809,19157587,"terminus. Since a single HERG channel protein consists of four alpha-subunits, the truncated subunit based on Q738X would hinder the normal assembly of healthy subunits and therefore exerting a dominant negative suppression effects"
https://pharos.nih.gov/idg/targets/Q12809,Q12809,19149796,"rs1805123 in HERG trended toward significance with shorter QTc in myocardial sodium and potassium channel genes of diabetics."
https://pharos.nih.gov/idg/targets/Q12809,Q12809,19149796,"Observational study of gene-disease association. (HuGE Navigator)"
https://pharos.nih.gov/idg/targets/Q12809,Q12809,19136169,"In a Spanish family in whom previous repetitive syncope episodes, sudden death, and pathological prolongation of the QT interval are documented, a novel heterozygous mutation in the KCNH2 gene is identified that causes arrhythmia in the carriers."
