"URL","Uniprot ID","PMID","Abstract"
https://pharos.nih.gov/idg/targets/P16389,P16389,29050392,"study indicates well represented genotype-phenotype associations between three subgroups of patients with KCNA2 encephalopathy according to the electrophysiological features of the mutations."
https://pharos.nih.gov/idg/targets/P16389,P16389,28658141,"Pharmacogenetic and case-control study evaluated the role of the variants of KCNA1, KCNA2, and KCNV2 in the susceptibility and drug resistance of genetic generalized epilepsies and revealed no significant association between 8 variants of KCNA1, KCNA2, and KCNV2 genes and risk or drug resistance of genetic generalized epilepsies after a Bonferroni correction for multiple comparisons."
https://pharos.nih.gov/idg/targets/P16389,P16389,27733563,"This study demonstrated that KCNA2 mutation causes episodic ataxia and pharmacoresponsive epilepsy."
https://pharos.nih.gov/idg/targets/P16389,P16389,27543892,"Novel recurrent missense mutation within the Kv1.2 voltage sensor associated with variable phenotypes, including hereditary spastic paraplegia, ataxia, and intellectual disability."
https://pharos.nih.gov/idg/targets/P16389,P16389,27062609,"In the asymptomatic mother, the mutated copy of the CDKL5 gene was inactivated in 90% of blood cells. We also identified a premature stop codon (p.Arg926*) in IQSEC2 in a patient with a Rett-like phenotype. Finally, exome sequencing enabled us to characterize a heterozygous de novo missense (p.Val408Ala) in KCNA2 in a girl with infantile-onset seizures variant of Rett syndrome (RTT)"
https://pharos.nih.gov/idg/targets/P16389,P16389,26646078,"Use-dependent activation of Kv1.2 channels is mediated by an extrinsic regulator that binds preferentially to the channel closed state, with Thr252 being necessary but not sufficient for this interaction to alter channel function."
https://pharos.nih.gov/idg/targets/P16389,P16389,25751627,"KCNA2 is a new gene involved in human neurodevelopmental disorders through two different mechanisms, predicting either hyperexcitability or electrical silencing of KV1.2-expressing neurons."
https://pharos.nih.gov/idg/targets/P16389,P16389,25477152,"This gene has not been previously described as a cause of disease in humans, but mutations of the orthologous gene in mice (Kcna2) are known to cause both ataxia and convulsions"
https://pharos.nih.gov/idg/targets/P16389,P16389,25300013,"the inhibition of two K(+) channel isoforms, Kv1.2 and KCa3.1, by two drug molecules, lidocaine and TRAM-34, is examined in atomic detail using molecular dynamics simulations."
https://pharos.nih.gov/idg/targets/P16389,P16389,24782544,"Using mutagenesis and analysis of gating currents from gating pore mutations in the Shaker Kv channel, we identified statistically highly significant correlations between VSD function and physicochemical properties of gating pore residues."
https://pharos.nih.gov/idg/targets/P16389,P16389,24682423,"isoform betaII plays a central role in the PKC-dependent regulation of Kv1.5/Kvbeta1.2 channels."
https://pharos.nih.gov/idg/targets/P16389,P16389,22649228,"This study indicated that the T2DM condition leads to potassium channel-mediated peripheral nerve hyperexcitability , thus identifying them as a potential drug target to treat some of the DPN related symptoms."
https://pharos.nih.gov/idg/targets/P16389,P16389,21906595,"The immunoreactivity of potassium channels (Kv1.2) was markedly reduced in the ventral roots, but normal in the dorsal roots of all the amyotrophic lateral sclerosis patients."
https://pharos.nih.gov/idg/targets/P16389,P16389,21044565,"observe for both the open and closed conformations of the Kv1.2 that specific mutations of S4 gating-charge residues destabilize the electrostatic network between helices of the voltage sensor domain"
https://pharos.nih.gov/idg/targets/P16389,P16389,20842544,"in addition to its known effect on pore stability, V370 of Kv1.2 is also crucial in controlling ion selectivity."
https://pharos.nih.gov/idg/targets/P16389,P16389,20584892,"Using fluorimetry and gating currents, study of the Kv1.2 voltage sensor domain revealed at least two independent conformational changes in this region in response to depolarization."
https://pharos.nih.gov/idg/targets/P16389,P16389,19883299,"molecular model for how the pre-gating process occurs in sequential steps: Gating charge response, movement and stabilization of the S4 voltage sensor domain, and movement near the base of the S5 region to close the pore domain."
https://pharos.nih.gov/idg/targets/P16389,P16389,19713757,"analysis of molecular basis for the actions of KVbeta1.2 on the opening and closing of the KV1.2 delayed rectifier channel"
https://pharos.nih.gov/idg/targets/P16389,P16389,19435843,"Data show that multivalent calix[4]arene ligands bind to the surface of voltage-dependent potassium channels (K(v)1.2 in a reversible manner."
https://pharos.nih.gov/idg/targets/P16389,P16389,19403695,"Both receptor-stimulated and steady-state Kv1.2 trafficking modulated by RhoA/ROCK required the activation of dynamin as well as the ROCK effector Lim-kinase, indicating a key role for actin remodeling in RhoA-dependent Kv1.2 regulation."
https://pharos.nih.gov/idg/targets/P16389,P16389,18474843,"The spectrum of neurologic manifestations and neoplasms associated with voltage-gated potassium channel (VGKC) autoimmunity is broader than previously recognized"
https://pharos.nih.gov/idg/targets/P16389,P16389,18053989,"the numbers of Kv1.2 channels are higher in DRs than VRs."
https://pharos.nih.gov/idg/targets/P16389,P16389,18042681,"Replacement of the N-terminal domain of maurotoxin by the one of the Agitoxin 2 chimera results in reorganization of disulfide bridge arrangements and increase of affinity to the Kv1.2 channel."
https://pharos.nih.gov/idg/targets/P16389,P16389,18003609,"Kv1.2 levels at the cell surface are kept in dynamic balance by opposing effects of cAMP"
https://pharos.nih.gov/idg/targets/P16389,P16389,17959782,"Kv1.2 and cortactin interact in vivo"
https://pharos.nih.gov/idg/targets/P16389,P16389,17576778,"MK2-HSP27 pathway regulates the NF-kappaB transcriptional output by switching the activation pattern from high level to low level."
https://pharos.nih.gov/idg/targets/P16389,P16389,17234891,"our results demonstrate the multiplicity of gating inhibition of different K(v) channels by Syn-1A and is compatible with versatility of Syntaxin-1A modulation of repolarization in various secretory and nonsecretory (smooth muscle) cell types."
https://pharos.nih.gov/idg/targets/P16389,P16389,15215309,"endocytosis of Kv1.2 from the cell surface is a key mechanism for channel suppression by tyrosine kinases"
https://pharos.nih.gov/idg/targets/Q96PR1,Q96PR1,23628987,"Kv3.2 is not different in distribution or in level between normal and schizophrenia cases, nor influenced by antipsychotic drugs, in any brain region tested"
https://pharos.nih.gov/idg/targets/Q96PR1,Q96PR1,23475819,"This family's complex phenotype is associated with a new chromosomal deletion, which suggests potential roles for the two genes, KCNC2 and ATXN7L3B, in human neurological disease."
https://pharos.nih.gov/idg/targets/Q96PR1,Q96PR1,21912965,"Although all KV3 subunit transcripts are significantly expressed at embryonic age in whole brain extracts, only KV3.1, KV3.2 and KV3.4 subunit transgenic proteins are present."
https://pharos.nih.gov/idg/targets/Q96PR1,Q96PR1,19332619,"In the absence of potassium ion, significant N-methyl-D-glucamine (NMDG)-positive currents could be recorded from human embryonic kidney cells expressing Kv3.1 or Kv3.2b channels and Kv1.5 Arg487Tyr/Val, but not wild-type channels."
https://pharos.nih.gov/idg/targets/Q9ULD8,Q9ULD8,20638388,"report on the binding of HIV-1 gp120 to the cytoplasmic C-terminus of the voltage-gated potassium channel BEC1, an interaction that can result in the repression of BEC's activity and the inhibition of HIV-1 particle-release"
https://pharos.nih.gov/idg/targets/Q9ULD8,Q9ULD8,20638388,"HIV-1 gp120 binds to the C-terminus (amino acids 973-1083) of BEC1 in vitro and in living cells. Overexpression of BEC1 inhibits HIV-1 particle release from 293T cells. This requires the C-terminus of BEC1"
https://pharos.nih.gov/idg/targets/Q9ULD8,Q9ULD8,19923296,"BEC1 is negatively involved in cognitive functions with no abnormal behaviors such as spontaneous seizures or motor dysfunction."
https://pharos.nih.gov/idg/targets/Q9UK17,Q9UK17,26216464,"Mefloquine is a concentration-dependent Ito and hKv4.3 channel blocker."
https://pharos.nih.gov/idg/targets/Q9UK17,Q9UK17,26016905,"mutations cause a gainoffunction of KV4.3/KChIP2encoded channels by increasing membrane protein expression and slowing channel inactivation."
https://pharos.nih.gov/idg/targets/Q9UK17,Q9UK17,25854634,"Altered Kv4.3 channel localization and/or functioning resulting from SCA19/22 mutations may lead to Purkinje cell loss, neurodegeneration and ataxia."
https://pharos.nih.gov/idg/targets/Q9UK17,Q9UK17,25600224,"the interaction of DPP10a, expressed in human atrium, with Kv4.3 channels generates a sustained current component of Ito, which may affect late repolarization phase of atrial action potentials."
https://pharos.nih.gov/idg/targets/Q9UK17,Q9UK17,24963029,"Demonstrate SEMA3A as a naturally occurring protein that selectively inhibits Kv4.3 and SEMA3A as a possible Brugada syndrome susceptibility gene through a Kv4.3 gain-of-function mechanism."
https://pharos.nih.gov/idg/targets/Q9UK17,Q9UK17,24845726,"These results indicate that Kv4.3 is likely the target of discrepin and highlight the importance of the basic residue K13, located in the alpha-helix of the toxin, for current blockage."
https://pharos.nih.gov/idg/targets/Q9UK17,Q9UK17,24762397,"Kv4.3 K(+) channel is involved in heart hypertrophy/heart failure independently of its electric function.[review]"
https://pharos.nih.gov/idg/targets/Q9UK17,Q9UK17,23963749,"findings indicate mutations in KCND3 are not a common cause of disease among rarer types of European cerebellar ataxia; however 2 variants were identified in the SCA cases: p.L450F and p.P614S; mutations in KCND3 can cause 2 allelic disorders, SCA19/22 and Brugada syndrome which may co-occur"
https://pharos.nih.gov/idg/targets/Q9UK17,Q9UK17,23400760,"Report a KV4.3 gain-of-function mutation in early-onset persistent lone atrial fibrillation."
https://pharos.nih.gov/idg/targets/Q9UK17,Q9UK17,23291429,"The biophysical characteristics of Kv4.3 channels are strongly dependent on temperature."
https://pharos.nih.gov/idg/targets/Q9UK17,Q9UK17,23280838,"This study demonistrated that KCND3 mutations cause SCA19 by impaired protein maturation and/or reduced channel function"
https://pharos.nih.gov/idg/targets/Q9UK17,Q9UK17,23280837,"This study demonistrated that Mutations in KCND3 cause spinocerebellar ataxia type 22 in chinese and japanese."
https://pharos.nih.gov/idg/targets/Q9UK17,Q9UK17,23036686,"expression of the sodium (SCN5A) and potassium (KCND3) channels as well as the fibrosis content in the ventricles of heart failure and of non-diseased hearts under different post-mortem intervals"
https://pharos.nih.gov/idg/targets/Q9UK17,Q9UK17,22457051,"KCND3 may serve as a rare genetic substrate in the pathogenesis of autopsy-negative sudden unexplained death (SUD) but not sudden infant death syndrome (SIDS) cases."
https://pharos.nih.gov/idg/targets/Q9UK17,Q9UK17,22198508,"Human atrial I(to) and cloned hKv4.3 channels are modulated by EGFR kinase via phosphorylation of the Y136 residue and by Src-family kinases via phosphorylation of the Y108 residue."
https://pharos.nih.gov/idg/targets/Q9UK17,Q9UK17,22023388,"Deep insights into the mechanism of the regulation of Kv4.3 K channels and the role of Kv4.3 K channels in cell death."
https://pharos.nih.gov/idg/targets/Q9UK17,Q9UK17,21422811,"The \"structurally minimal\" isoform KChIP2d modulates recovery of K(v)4.3 N-terminal deletion mutant Delta2-39."
https://pharos.nih.gov/idg/targets/Q9UK17,Q9UK17,21349352,"Kv4.3 macromolecular complex and regulators of KCND3 expression is needed to elucidate the role of the Ito current in the pathogenesis of BrS and other J-wave syndromes."
https://pharos.nih.gov/idg/targets/Q9UK17,Q9UK17,21129448,"our findings suggest that KChIP1 interacts with Kv4.3 in interneurons at the stratum lacunosum-moleculare/radiatum junction"
https://pharos.nih.gov/idg/targets/Q9UK17,Q9UK17,20649599,"The I(to) activator NS5806 modified Kv4.3/KChIP2 gating in several ways that inhibit current."
https://pharos.nih.gov/idg/targets/Q9UK17,Q9UK17,20550899,"KChIP4a functions to promote tetrameric assembly and enhance surface expression of Kv4 channels."
https://pharos.nih.gov/idg/targets/Q9UK17,Q9UK17,20379614,"Clinical trial of gene-disease association and gene-environment interaction. (HuGE Navigator)"
https://pharos.nih.gov/idg/targets/Q9UK17,Q9UK17,20354865,"N-linked glycosylation of DPP10 plays an important role in modulating Kv4.3 channel/KCHIP2 complex activities."
https://pharos.nih.gov/idg/targets/Q9UK17,Q9UK17,19927631,"Down-regulated atrial KChIP2 and Kv4.3 mRNA expressions in rheumatic heart disease patients with chronic atrial fibrillation might be one of the molecular bases responsible for the down-regulation of the I(to) current density of AF."
https://pharos.nih.gov/idg/targets/Q9UK17,Q9UK17,19213956,"SAP97 is a major partner for surface expression and CaMKII-dependent regulation of cardiac Kv4.2 and kv4.3 channels."
https://pharos.nih.gov/idg/targets/Q9UK17,Q9UK17,18678642,"NO and NO donors inhibited I(Kv4.3) in a concentration- and voltage-dependent manner."
https://pharos.nih.gov/idg/targets/Q9UK17,Q9UK17,18620005,"c-Src-induced Kv4.3 channel activation involves their association in a macromolecular complex"
https://pharos.nih.gov/idg/targets/Q9UK17,Q9UK17,18052691,"KCND3 mutations were not found to directly cause long QT syndrome."
https://pharos.nih.gov/idg/targets/Q9UK17,Q9UK17,17725712,"Kv4.3 regulates angiotensin type 1 receptor signaling to the small G-protein Rap-1"
https://pharos.nih.gov/idg/targets/Q9UK17,Q9UK17,17506992,"the mechanisms involved in Syn1A-K(v) interactions vary significantly between K(v) channels, thus providing a wide scope for Syn1A modulation of exocytosis and membrane excitability"
https://pharos.nih.gov/idg/targets/Q9UK17,Q9UK17,16782062,"KCNE3 also inhibits currents generated by Kv4.3 in complex with the accessory subunit KChIP2"
https://pharos.nih.gov/idg/targets/Q9UK17,Q9UK17,15890703,"Co-expression of DPPX in addition to Kv4.3 and KChIP2a produced similar current kinetics as in human ventricular myocytes"
https://pharos.nih.gov/idg/targets/Q9UK17,Q9UK17,15578212,"Co-expression of SGK1, but not of SGK2 or SGK3, increased Kv 4.3/KChIP2b channel currents."
https://pharos.nih.gov/idg/targets/Q9UK17,Q9UK17,15563876,"Observational study of genotype prevalence. (HuGE Navigator)"
https://pharos.nih.gov/idg/targets/Q9UK17,Q9UK17,15563876,"mutations in KCND2 and KCND3 are not a frequent cause of long QT syndrome"
https://pharos.nih.gov/idg/targets/Q9UK17,Q9UK17,15498806,"Both Kv4.3 and KChIP2 may contribute to epicardial-endocardial gradients in the transient outward current in normal and failing hearts."
https://pharos.nih.gov/idg/targets/Q9UK17,Q9UK17,15148151,"Observational study of genotype prevalence. (HuGE Navigator)"
https://pharos.nih.gov/idg/targets/Q9UK17,Q9UK17,14645239,"the two arginines in the cytosolic C-terminal domain of alpha-subunits of Kv4 subfamily strongly regulate the voltage dependence of channel activation, inactivation, and recovery"
https://pharos.nih.gov/idg/targets/Q9UK17,Q9UK17,12928444,"Analysis with chimeric proteins between KChIP2 and NCS-1 reveals that the three regions of KChIP2 are necessary and sufficient for its effective binding to Kv4.3 protein"
https://pharos.nih.gov/idg/targets/Q9UK17,Q9UK17,12384780,"maps to chromosome 1p21-q21 and identification in Dutch autosomal dominant cerebellar ataxia family"
https://pharos.nih.gov/idg/targets/Q9UK17,Q9UK17,12297301,"Kv4.3 promiscuously assembles with ancillary subunits in vitro, functionally modifying the encoded currents."
https://pharos.nih.gov/idg/targets/Q9UIX4,Q9UIX4,22082156,"Knockdown of KCNG1 by siRNA enhances the early stages of HIV-1 replication in HeLa-CD4 cells infected with viral pseudotypes HIV89.6R and HIV8.2N"
https://pharos.nih.gov/idg/targets/Q9UIX4,Q9UIX4,19460752,"Knockdown of KCNG1 by siRNA enhances the early stages of HIV-1 replication in HeLa-CD4 cells infected with viral pseudotypes HIV89.6R and HIV8.2N"
https://pharos.nih.gov/idg/targets/Q14721,Q14721,28806457,"The results of this study support the conclusion that the KCNB1 variants described here are likely to be pathogenic in patient with Neurodevelopmental Disorders."
https://pharos.nih.gov/idg/targets/Q14721,Q14721,28768770,"Data suggest that NMDAR plays key role in mediating effect of leptin to modulate function of insulin-secreting cells by promoting AMPK-dependent trafficking of KATP and Kv2.1 channels to plasma membrane. (NMDAR = N-methyl-D-aspartate receptor; AMPK = AMP-activated protein kinase; KATP = ATP-sensitive potassium channel; Kv2.1 = delayed-rectifier potassium channel 1)"
https://pharos.nih.gov/idg/targets/Q14721,Q14721,28607108,"Kv2.1, but not Kv2.2 (KCNB2), forms clusters of 6-12 tetrameric channels at the plasma membrane and facilitates insulin exocytosis. Knockdown of Kv2.1 expression reduces secretory granule targeting to the plasma membrane. KCNB1 appears reduced in T2D islets, and further knockdown of KCNB1 does not inhibit Kv current in T2D beta-cells. Upregulation of Kv2.1-wild-type, but not Kv2.1-DeltaC318, rescues the exocytotic phen..."
https://pharos.nih.gov/idg/targets/Q14721,Q14721,28373283,"the first six N-terminal residues including Lys-3, Lys-4, and Leu-5 are critical for controlling functional regulation, but not trafficking, of BK channels. This membrane-distal region has features of an amphipathic helix that is predicted to control the orientation of the first transmembrane-spanning domain (TM1) of the beta1-subunit."
https://pharos.nih.gov/idg/targets/Q14721,Q14721,26922553,"Perifosine modified the Kv2.1 inactivation gating resulting in a decrease of the current amplitude."
https://pharos.nih.gov/idg/targets/Q14721,Q14721,26505474,"KvS subunits modify the pharmacological response of Kv2 subunits when assembled in heterotetramers and illustrate the potential of KvS subunits to provide unique properties to the heterotetramers, as is the case for 4-AP on Kv2.1/Kv6.4 channels."
https://pharos.nih.gov/idg/targets/Q14721,Q14721,26503721,"Epileptic V378A variant in KCNB1 changes ion selectivity, trafficking and expression of Kv2.1 channel."
https://pharos.nih.gov/idg/targets/Q14721,Q14721,26487174,"inactivation regulation via Ca(2+)/calmodulin does not interfere with the beta subunit's enzymatic activity as an NADPH-dependent oxidoreductase, thus rendering the Kvb1.1 subunit a multifunctional receptor"
https://pharos.nih.gov/idg/targets/Q14721,Q14721,26477325,"Kv2.1 functional aberrations in humans are associated with developmental delay, infantile generalized seizures, hypotonia, and behavioural problems, and also highlight a critical role for Kv2.1 in regulating neuronal firing in neuronal circuits."
https://pharos.nih.gov/idg/targets/Q14721,Q14721,26393286,"HIV-1 Env gp120 upregulates voltage-gated potassium channels (Kv2.1) via p38 MAPK pathway in hippocampal neurons"
https://pharos.nih.gov/idg/targets/Q14721,Q14721,26377690,"The results indicate that KCNB1 is likely associated with metabolic traits that may either predispose or protect from progression to metabolic syndrome."
https://pharos.nih.gov/idg/targets/Q14721,Q14721,26303499,"HO-1 expression can strongly influence apoptosis via CO-mediated regulation of Kv2.1 activity"
https://pharos.nih.gov/idg/targets/Q14721,Q14721,26242757,"KCNE5 subunits may affect Kv2.1 homotetramers and Kv2.1/Kv6.4 heterotetramers in vivo, resulting in more tissue-specific fine-tuning mechanisms."
https://pharos.nih.gov/idg/targets/Q14721,Q14721,26240432,"KCNB1 is a strong susceptibility gene for schizophrenia spectrum disorders in humans."
https://pharos.nih.gov/idg/targets/Q14721,Q14721,25908859,"Glutamate exposure results in a loss of Kv2.1 clusters in neurons."
https://pharos.nih.gov/idg/targets/Q14721,Q14721,25164438,"This study identified a de novo missense mutation in KCNB1 that encodes the KV 2.1 voltage-gated potassium channel."
https://pharos.nih.gov/idg/targets/Q14721,Q14721,24667918,"HIV-1 Env gp120 upregulates voltage-gated potassium channels (Kv2.1) via p38 MAPK pathway in hippocampal neurons"
https://pharos.nih.gov/idg/targets/Q14721,Q14721,24597762,"In cerebellar granule cells, regulation of Kv2.1 by GDF15 is mediated through the TGFbetaRII-activated Akt/mTOR pathway."
https://pharos.nih.gov/idg/targets/Q14721,Q14721,24086760,"HIV-1 Env gp120 upregulates voltage-gated potassium channels (Kv2.1) via p38 MAPK pathway in hippocampal neurons"
https://pharos.nih.gov/idg/targets/Q14721,Q14721,23431371,"The KCNB1 rs1051295 TT genotype is associated with decreased insulin sensitivity."
https://pharos.nih.gov/idg/targets/Q14721,Q14721,22560931,"Somatodendritic Kv2.1 channels in the motor neurons of lower spinal cord significantly decrease correlating with experimental autoimmune encephalomyelitis severity."
https://pharos.nih.gov/idg/targets/Q14721,Q14721,22442077,"The results of this study that KCNB1 is a novel mechanism of toxicity in neurodegenerative disease."
https://pharos.nih.gov/idg/targets/Q14721,Q14721,22411134,"Direct interaction between syntaxin 1A and the Kv2.1 C-terminus is required for efficient insulin exocytosis and glucose-stimulated insulin secretion."
https://pharos.nih.gov/idg/targets/Q14721,Q14721,22106938,"Here, we show that tyrosine phosphorylation by Src plays a fundamental role in regulating Kv2.1-mediated K(+) current enhancement. We found that the level of expression of the Kv2.1 protein is increased by Src kinase."
https://pharos.nih.gov/idg/targets/Q14721,Q14721,21455829,"Functional interactions between residues in the S1, S4, and S5 domains of Kv2.1 in human were studied."
https://pharos.nih.gov/idg/targets/Q14721,Q14721,21095721,"analysis of of kv2.1 channel diffusion observed by single molecule tracking in live cells"
https://pharos.nih.gov/idg/targets/Q14721,Q14721,20709754,"analysis of binding sites of structurally different antiarrhythmics flecainide and propafenone in the subunit interface of potassium channel Kv2.1"
https://pharos.nih.gov/idg/targets/Q14721,Q14721,20566856,"Data suggest that unique roles for the clustered Kv2.1 that are independent of K(+) conductance."
https://pharos.nih.gov/idg/targets/Q14721,Q14721,20547671,"Taken together the observations indicate that, as in Shaker, the quinidine-promoted collapse of Shab G(K) occurs during deactivation of the channels, at the end of each activating pulse, with a probability of 0.1 per pulse at 80 mV."
https://pharos.nih.gov/idg/targets/Q14721,Q14721,20379614,"Clinical trial of gene-disease association and gene-environment interaction. (HuGE Navigator)"
https://pharos.nih.gov/idg/targets/Q14721,Q14721,19717445,"in cells either infected with HCV or harboring an HCV subgenomic replicon, oxidative stress failed to initiate apoptosis via Kv2.1. The HCV NS5A protein mediated this effect by inhibiting oxidative stress-induced p38 MAPK phosphorylation of Kv2.1."
https://pharos.nih.gov/idg/targets/Q14721,Q14721,19454037,"KCNB1 may be involved in the development of LV hypertrophy in humans"
https://pharos.nih.gov/idg/targets/Q14721,Q14721,19265782,"rs237484 is in proximity to the potassium voltage gate channel gene (KCNB1) and close to the prostaglandin I2 (prostacyclin) synthase gene (PTGIS)."
https://pharos.nih.gov/idg/targets/Q14721,Q14721,19265782,"Observational study of gene-disease association. (HuGE Navigator)"
https://pharos.nih.gov/idg/targets/Q14721,Q14721,19223394,"SUMOylation can exert a strong inhibitory action on the voltage-dependent K(+) channel Kv2.1 and can regulate cellular excitability in native beta-cells."
https://pharos.nih.gov/idg/targets/Q14721,Q14721,19074135,"Mutation of histidine 105 in the T1 domain of the potassium channel Kv2.1 disrupts heteromerization with Kv6.3 and Kv6.4."
https://pharos.nih.gov/idg/targets/Q14721,Q14721,18690023,"Proteomic analysis of KV2.1 channel phosphorylation sites determining cell background specific differences in function is reported."
https://pharos.nih.gov/idg/targets/Q14721,Q14721,18212012,"structural analysis of the human recombinant Kv2.1 channel"
https://pharos.nih.gov/idg/targets/Q14721,Q14721,16880266,"Results support a model whereby an outer vestibule lysine interferes with K+ flux through the channel, and that the [K+]-dependent change in orientation of this lysine alters single channel conductance by changing the level of this interference."
https://pharos.nih.gov/idg/targets/Q14721,Q14721,16008572,"native Kv2.1 polypeptides are more abundantly found in brain"
https://pharos.nih.gov/idg/targets/Q14721,Q14721,15827117,"formation of heteromeric Kv2.1/Kv9.3 channels of fixed stoichiometry consisting of three Kv2.1 subunits and one Kv9.3 subunit"
https://pharos.nih.gov/idg/targets/Q14721,Q14721,15353504,"There is a central role for developmentally regulated ductus arteriosus SMC O2-sensitive Kv channels in the functional closure of the DA."
https://pharos.nih.gov/idg/targets/Q14721,Q14721,15024041,"direct functional interaction, which is modulated by permeant ions acting at the selectivity filter, between the outer vestibule of the Kv2.1 potassium channel and the voltage sensor."
https://pharos.nih.gov/idg/targets/Q14721,Q14721,12560340,"exposed residues in the T1 domain of the N terminus, as well as the CTA domain in the C terminus, are important in determining channel activation kinetics and that these N- and C-terminal regions interact"
