"URL","Uniprot ID","PMID","Abstract"
https://pharos.nih.gov/idg/targets/P22001,P22001,12807917,"Fas ligand increases Kv1.3 channel activity through the same canonical apoptotic signaling cascade that is required for potassium efflux, cell shrinkage, and apoptosis"
https://pharos.nih.gov/idg/targets/P22001,P22001,12632187,"manipulation of membrane cholesterol changed both the kinetic properties of Kv1.3 and steady-state parameters of activation by modifying lipid-protein interactions."
https://pharos.nih.gov/idg/targets/P22001,P22001,12604782,"distribution of FLAG epitope-tagged Kv1.3 channels (Kv1.3/FLAG) significantly differs from the stochastic Poisson distribution in the plasma membrane of human T lymphoma cells"
https://pharos.nih.gov/idg/targets/P22001,P22001,12150982,"role in apoptosis induced by actinomycin D"
https://pharos.nih.gov/idg/targets/O15554,O15554,29050937,"Higher epithelial KCNN4 expression was closely correlated with advanced TNM stages and predicted a poor prognosis in patients with pancreatic ductal adenocarcinoma."
https://pharos.nih.gov/idg/targets/O15554,O15554,28280257,"IKCa1 is overexpressed in cervical cancer tissues, and IKCa1 upregulation in cervical cancer cell linea enhances cell proliferation, partly by reducing the proportion of apoptotic cells."
https://pharos.nih.gov/idg/targets/O15554,O15554,28219898,"This work demonstrates the critical role of SK4 Ca(2+)-activated K(+) channels in adult pacemaker function."
https://pharos.nih.gov/idg/targets/O15554,O15554,28062499,"Blocking KCa3.1 suppresses plaque instability in advanced stages of atherosclerosis by inhibiting macrophage polarization toward an M1 phenotype."
https://pharos.nih.gov/idg/targets/O15554,O15554,28028617,"Implicating both KCa1.1 and KCa3.1 channels."
https://pharos.nih.gov/idg/targets/O15554,O15554,27542194,"Here, the authors demonstrate that phosphorylation of His358 activates KCa3.1 by antagonizing copper-mediated inhibition of the channel."
https://pharos.nih.gov/idg/targets/O15554,O15554,27470924,"This study found a very substantial functional expression of KCa3.1 channels in microglia from adult epilepsy patients."
https://pharos.nih.gov/idg/targets/O15554,O15554,27270322,"We identified a two-gene signature including KCNN4 and S100A14 which was related to recurrence in optimally debulked serous ovarian carcinoma patients"
https://pharos.nih.gov/idg/targets/O15554,O15554,27183905,"Data show that RNAi-mediated knockdown of KCa3.1 and/or TRPC1 leads to a significant decrease in cell proliferation due to cell cycle arrest in the G1 phase."
https://pharos.nih.gov/idg/targets/O15554,O15554,27165696,"Human arrhythmogenic calmodulin mutations impede the activation of SK2 channels in human embryonic kidney 293 cells."
https://pharos.nih.gov/idg/targets/O15554,O15554,27124117,"Findings suggest that SK4 channels are expressed in triple-negative breast cancer (TNBC) cells and are involved in the proliferation, apoptosis, migration and epithelial-mesenchymal transition processes of TNBC cells."
https://pharos.nih.gov/idg/targets/O15554,O15554,27092946,"KCa3.1 and CFTR colocalize at the plasma membrane."
https://pharos.nih.gov/idg/targets/O15554,O15554,27029904,"The results suggest that KCa3.1 activation contributes to dysfunctional tubular autophagy in diabetic nephropathy through PI3K/Akt/mTOR signaling pathways."
https://pharos.nih.gov/idg/targets/O15554,O15554,27020659,"KCa3.1 in human immature dendritic cells play a major role in their migration and constitute an attractive target for the cell therapy optimization"
https://pharos.nih.gov/idg/targets/O15554,O15554,26824610,"KCNN4 inhibition differentially regulates migration of intestinal epithelial cells in inflamed vs. non-inflamed conditions in a PI3K/Akt-mediated manner."
https://pharos.nih.gov/idg/targets/O15554,O15554,26689552,"KCa3.1 protein expression was increased in asthmatic compared to healthy airway epithelium in situ, and KCa3.1 currents were larger in asthmatic compared to healthy HBECs cultured in vitro"
https://pharos.nih.gov/idg/targets/O15554,O15554,26438401,"KCa3.1 blockade protects against cisplatin-induced acute kidney injury through the attenuation of apoptosis by interference with intrinsic apoptotic and endoplasmic reticulum stress-related mediators."
https://pharos.nih.gov/idg/targets/O15554,O15554,26418693,"Data show that calcium-dependent potassium channel KCa3.1 operates as a positive feedback mechanism for intracellular Ca2+ increase."
https://pharos.nih.gov/idg/targets/O15554,O15554,26198474,"describes patients from 2 well-phenotyped hereditary xerocytosis (HX) kindreds, including from one of the first HX kindreds described, who lack predicted heterozygous PIEZO1-linked variants"
https://pharos.nih.gov/idg/targets/O15554,O15554,26178367,"Novel Gardos channel mutations linked to dehydrated hereditary stomatocytosis (xerocytosis)."
https://pharos.nih.gov/idg/targets/O15554,O15554,26177720,"KCa3.1 activation in human lung mast cells is highly dependent on Ca(2+) influx through Orai1 channels, mediated via a close spatiotemporal interaction between the two channels."
https://pharos.nih.gov/idg/targets/O15554,O15554,26148990,"identification of a dominantly inherited missense mutation in the Gardos channel in 2 unrelated families and its association with chronic hemolysis and dehydrated cells, also referred to as hereditary xerocytosis"
https://pharos.nih.gov/idg/targets/O15554,O15554,26138196,"that KCa3.1 channels are key actors in the migration capacity of neutrophils, and its inhibition did not affect other relevant cellular functions"
https://pharos.nih.gov/idg/targets/O15554,O15554,25848765,"high KCa3.1-mRNA expression levels were indicative of low disease specific survival of ccRCC patients, short progression-free survival, and a high metastatic potential. Therefore, KCa3.1 is of prognostic value in ccRCC"
https://pharos.nih.gov/idg/targets/O15554,O15554,25545021,"The present study shows that KCNN4 is expressed at the mRNA and protein level in RA-SFs, is functionally active, and has a regulatory impact on cell proliferation and secretion of pro-inflammatory and pro-destructive mediators."
https://pharos.nih.gov/idg/targets/O15554,O15554,25477223,"Blood brain barrier endothelial cells exhibit KCa3.1 protein and activity."
https://pharos.nih.gov/idg/targets/O15554,O15554,25476248,"Ca2+- and KCa3.1-dependent processes facilitate \"constitutive\" alpha smooth muscle actin expression and Smad2/3 signalling in IPF-derived fibroblasts, and thus promote fibroblast to myofibroblast differentiation."
https://pharos.nih.gov/idg/targets/O15554,O15554,25415613,"The role and mechanisms of KCa3.1 in progressive diabetic chronic kidney disease are reviewed."
https://pharos.nih.gov/idg/targets/O15554,O15554,25372486,"Inhibition of K(Ca)3.1 by EETs (14,15-EET), 20-HETE, and omega3 critically depended on the presence of electron double bonds and hydrophobicity within the 10 carbons preceding the carboxyl-head of the molecules."
https://pharos.nih.gov/idg/targets/O15554,O15554,25300013,"the inhibition of two K(+) channel isoforms, Kv1.2 and KCa3.1, by two drug molecules, lidocaine and TRAM-34, is examined in atomic detail using molecular dynamics simulations."
https://pharos.nih.gov/idg/targets/O15554,O15554,24963668,"KCa3.1 has a role in diabetic nephropathy. (review)"
https://pharos.nih.gov/idg/targets/O15554,O15554,24885636,"Tumor-associated macrophages participate in the metastasis of CRC induced by PRL-3 through secretion of IL-6 and IL-8 in a KCNN4 dependent manner."
https://pharos.nih.gov/idg/targets/O15554,O15554,24826782,"These data suggest that NO activates KCNN4 channels through the PKG but not the PKA pathways."
https://pharos.nih.gov/idg/targets/O15554,O15554,24733189,"Overexpression of CCL20 in human proximal tubular cells is inhibited by blockade of KCa3.1 under diabetic conditions through inhibition of the NF-kappaB pathway."
https://pharos.nih.gov/idg/targets/O15554,O15554,24585442,"KCa3.1 confers an invasive phenotype that significantly worsens a patient's outlook with malignant glioma."
https://pharos.nih.gov/idg/targets/O15554,O15554,24470490,"The channel gating process for KCa3.1 and the S5 transmembrane segment is controlled by aromatic-aromatic interactions involving the pore helix."
https://pharos.nih.gov/idg/targets/O15554,O15554,24392001,"KCa3.1 pharmacological blockade attenuated human myofibroblast proliferation, wound healing, collagen secretion and contractility in vitro, and this was associated with inhibition of TGFbeta1-dependent increases in intracellular free Ca2+."
https://pharos.nih.gov/idg/targets/O15554,O15554,24312257,"Our findings suggest that KCa3.1 channels play an important role in the pathogenesis of chronic AV and constitute an attractive target for the prevention of arteriopathy."
https://pharos.nih.gov/idg/targets/O15554,O15554,24227782,"Adenosine inhibits KCa3.1 in human T cells via A2A receptor & PKAI. Comparable effects were obtained by KCa3.1 blockade with TRAM-34. Adenosine suppresses IL-2 secretion via KCa3.1 inhibition."
https://pharos.nih.gov/idg/targets/O15554,O15554,24193405,"Mg(2+) inhibits KCa3.1 via a rapid, voltage-dependent mechanism that leads to a reduction of the channel's unitary current and by reducing the open probability of the channel"
https://pharos.nih.gov/idg/targets/O15554,O15554,24166472,"blockade of KCa3.1 attenuates diabetic renal interstitial fibrogenesis through inhibiting activation of fibroblasts"
https://pharos.nih.gov/idg/targets/O15554,O15554,24158513,"Globotriaosylceramide accelerates the endocytosis and lysosomal degradation of endothelial KCa3.1 via a clathrin-dependent process, leading to endothelial dysfunction in Fabry disease."
https://pharos.nih.gov/idg/targets/O15554,O15554,24146918,"blocking KCa3.1 increases the degranulation and cytotoxicity of adherent Natural killer cells, but not of non-adherent-Natural killer cells."
https://pharos.nih.gov/idg/targets/O15554,O15554,24138859,"This study provides insight into the key molecular determinants for the high-affinity binding of peptide toxins to KCa3.1."
https://pharos.nih.gov/idg/targets/O15554,O15554,24055799,"These findings highlight a novel role for the KCa3.1 channel in human BSM cell phenotypic modulation."
https://pharos.nih.gov/idg/targets/O15554,O15554,23949222,"KCa3.1 activity has an important role in glioblastoma invasiveness."
https://pharos.nih.gov/idg/targets/O15554,O15554,23904164,"KCa3.1 channels contribute to the regulation of glucocorticosteroid-resistant inflammatory pathways in airway smooth musclecells"
https://pharos.nih.gov/idg/targets/O15554,O15554,23792675,"CaMKK/Akt/p300 cascade plays an important role in laminar stress-dependent induction of KCa2.3 and KCa3.1 expression, thereby regulating EC function and adaptation to hemodynamic changes."
https://pharos.nih.gov/idg/targets/O15554,O15554,23720748,"Data indicate that Epac1-Rap1A-RhoA-ROCK signaling affects Cl- secretion via effects on the apical expression of KCNN4c channels."
https://pharos.nih.gov/idg/targets/O15554,O15554,23609438,"KCa3.1 plays an important role in VSMC proliferation via controlling Ca(2+)-dependent signaling pathways"
https://pharos.nih.gov/idg/targets/O15554,O15554,23589888,"A previously unrecognized Ca(2+)-activated intermediate K(+) conductance (IK(Ca), KCa3.1, or SK4) in young and old stage-derived human embryonic stem cell-derived cardiomyocytes, was identified."
https://pharos.nih.gov/idg/targets/O15554,O15554,23572150,"Explored the mechanism by which PRL-3 mediates EMT. Demonstrated that PRL-3 induced the expression of KCNN4 channels, leading to EMT and the down-regulation of E-cadherin."
https://pharos.nih.gov/idg/targets/O15554,O15554,23407879,"KCa3.1 in HEL cells displays a unique form of voltage dependence modulating open channel probability."
https://pharos.nih.gov/idg/targets/O15554,O15554,23392713,"Our results suggested that IKCa1 may play a role in the proliferation of human HCC, and IKCa1 blockers may represent a potential therapeutic strategy for HCC."
https://pharos.nih.gov/idg/targets/O15554,O15554,23345219,"K(Ca)3.1 and ClC-3 are expressed in tissue samples obtained from patients diagnosed with grade IV gliomas. Both K(Ca)3.1 and ClC-3 colocalize to the invading processes of glioma cells"
https://pharos.nih.gov/idg/targets/O15554,O15554,23261940,"results provide evidence plasma from preeclampsia generates superoxide via a LOX1-NOX2-mediated pathway and downregulates endothelial KCa3.1, which may contribute to endothelial dysfunction and vasculopathy in preeclampsia"
https://pharos.nih.gov/idg/targets/O15554,O15554,21872912,"The K(+) channel K(Ca)3.1 plays a key role in human fibrocyte migration"
https://pharos.nih.gov/idg/targets/O15554,O15554,21725609,"PRL-3 promoted the proliferation of LoVo cells through upregulation of KCNN4 channels which facilitated the G2/M transition."
https://pharos.nih.gov/idg/targets/O15554,O15554,21551009,"hypoxic exercise training this intervention depresses Gardos channel-modulated erythrocyte rheological functions"
https://pharos.nih.gov/idg/targets/O15554,O15554,21465474,"This study focussed on the endocytic internalization and the intracellular transport of the human isoform hK(Ca)3.1."
https://pharos.nih.gov/idg/targets/O15554,O15554,21345794,"the N-terminal domain of K(Ca)3.1 is critical for channel trafficking to the plasma membrane"
https://pharos.nih.gov/idg/targets/O15554,O15554,21228320,"Results are consistent with the notion that human K(Ca)3.1 channels are assembled from two homomeric dimers and not randomly from four independent subunits."
https://pharos.nih.gov/idg/targets/O15554,O15554,21172909,"Intermediate conductance calcium-activated potassium channel mediates vasodilation together with nitric oxide and connexin 37 in mesenteric artery."
https://pharos.nih.gov/idg/targets/O15554,O15554,21123738,"Data suggest that human IK1-induced cell proliferation occurs by a direct interaction with ERK1/2 and JNK signaling pathways."
https://pharos.nih.gov/idg/targets/O15554,O15554,20808839,"Ca(2+)-activated K(+) channels do not play a critical role in proliferation of glioma cells"
https://pharos.nih.gov/idg/targets/O15554,O15554,20720181,"These results are the first to demonstrate that plasma membrane-associated KCa3.1 is targeted for lysosomal degradation via a Rab7 and ESCRT-dependent pathway."
https://pharos.nih.gov/idg/targets/O15554,O15554,20712009,"hKCa3.1 might contribute to breast tumour-progression and can serve as a useful prognostic marker for breast cancer."
https://pharos.nih.gov/idg/targets/O15554,O15554,20501432,"IK1 channels are present in biliary epithelial cells and contribute to ATP-stimulated secretion through a P2Y-IP3 receptor pathway."
https://pharos.nih.gov/idg/targets/O15554,O15554,20407432,"Our data implicate the role of KCNN4 in ileal Crohn Disease."
https://pharos.nih.gov/idg/targets/O15554,O15554,20407432,"Observational study of gene-disease association. (HuGE Navigator)"
https://pharos.nih.gov/idg/targets/O15554,O15554,20036632,"presence of mtKCa3.1 in tumor cell lines using biochemical and electrophysiological approaches"
https://pharos.nih.gov/idg/targets/O15554,O15554,19823864,"Data demonstrate that bestrophin 1 is localized in the endoplasmic reticulum (ER), where it interacts with the ER-Ca(2+) sensor and can enhance Ca(2+) signaling and activation of Ca(2+)-dependent Cl(-) (TMEM16A) and K(+) (SK4) channels."
https://pharos.nih.gov/idg/targets/O15554,O15554,19644414,"The aim of this study was to investigate the relationship between single-nucleotide polymorphisms (SNPs) in the human KCNN4 gene or haplotypes and the incidence of myocardial infarction or cerebral infarction in Japanese."
https://pharos.nih.gov/idg/targets/O15554,O15554,19644414,"Observational study of gene-disease association. (HuGE Navigator)"
https://pharos.nih.gov/idg/targets/O15554,O15554,19608980,"Nitric oxide increases cardiac IK1 by nitrosylation of cysteine 76 of Kir2.1 channels."
https://pharos.nih.gov/idg/targets/O15554,O15554,19587117,"Data show that the class II phosphatidylinositol 3 kinase C2beta (PI3K-C2beta) is activated by the T-cell receptor (TCR) and functions upstream of NDPK-B to activate KCa3.1 channel activity."
https://pharos.nih.gov/idg/targets/O15554,O15554,19409928,"The expression level of K(Ca)3.1 channels was similar in all T cell subsets in multiple sclerosis patients."
https://pharos.nih.gov/idg/targets/O15554,O15554,19406468,"Data show that moderate increases of mitochondrial matrix [Ca(2+)] will cause mtK(Ca)3.1 opening, thus linking inner membrane K(+) permeability and transmembrane potential to Ca(2+) signalling."
https://pharos.nih.gov/idg/targets/O15554,O15554,19270724,"overexpression of the IK(Ca1) channel is likely to promote carcinogenesis in human prostate tissue."
https://pharos.nih.gov/idg/targets/O15554,O15554,19052260,"Inhibition of the KCa3.1 channels by AMP-activated protein kinase in human airway epithelial cells."
https://pharos.nih.gov/idg/targets/O15554,O15554,18796614,"the mammalian protein histidine phosphatase (PHPT-1) directly binds and inhibits KCa3.1 by dephosphorylating histidine 358 on KCa3.1"
https://pharos.nih.gov/idg/targets/O15554,O15554,18792407,"findings show the G(s)-coupled EP(2) receptor closes K(Ca)3.1 in lung mast cells and attenuates both chemokine- and PGE(2)-dependent lung mast cell migration"
https://pharos.nih.gov/idg/targets/O15554,O15554,18690018,"An NH2-terminal multi-basic RKR motif is required for the ATP-dependent regulation of IK1."
https://pharos.nih.gov/idg/targets/O15554,O15554,18688283,"KCa3.1 contributes to atherogenesis in mice and humans"
https://pharos.nih.gov/idg/targets/O15554,O15554,18547995,"KCa3.1 channels play a critical role in transcellular chloride secretion and net fluid transport into the kidney cysts of patients with ADPKD by maintaining"
https://pharos.nih.gov/idg/targets/O15554,O15554,18367588,"IK1 channel activity appears to mediate, at least in part, the response of epidermoid cancer cells to cisplatin treatment."
https://pharos.nih.gov/idg/targets/O15554,O15554,18287336,"KCa3.1 channels are not immobilized at the front but move in a diffuse way throughout the plasma membrane of migrating cells."
https://pharos.nih.gov/idg/targets/O15554,O15554,18227067,"KCa3.1 and KCa2.3 are translocated out of the endoplasmic reticulum associated with Derlin-1."
https://pharos.nih.gov/idg/targets/O15554,O15554,18184876,"KCNN4 channels, possibly in parallel with volume-sensitive outwardly rectifying Cl channels, effect regulatory volume decrease in lens epithelial cells."
https://pharos.nih.gov/idg/targets/O15554,O15554,17762175,"SK4 channels activity, underlying the Ca(2+)-dependent K(+) permeability was in particular increased by IL-13"
https://pharos.nih.gov/idg/targets/O15554,O15554,17585114,"KCa3.1 channels are important in human airway smooth muscle cell proliferation."
https://pharos.nih.gov/idg/targets/O15554,O15554,17474152,"The G(alphas)-coupled adenosine A2A receptor closes KCa3.1, providing a clearly defined mechanism by which adenosine inhibits human lung mast cell migration and degranulation."
https://pharos.nih.gov/idg/targets/O15554,O15554,17470662,"KCNN4 activity decines sharply throughout the lifespan of human red blood cells."
https://pharos.nih.gov/idg/targets/O15554,O15554,17353352,"S6 transmembrane segment of the open KCa3.1 channel contains two functional domains delimited by V282 with MTSEA and MTSET binding leading to a channel inhibition at V275, T278, and V282 and to a steep channel activation at positions A283 and A286"
https://pharos.nih.gov/idg/targets/O15554,O15554,17310992,"Increased activity of IKCa1 channel is necessary for the development of endometrial cancer."
https://pharos.nih.gov/idg/targets/O15554,O15554,17157250,"We show that nucleoside diphosphate kinase B (NDPK-B), a mammalian histidine kinase, functions downstream of PI(3)P to activate KCa3.1 by phosphorylating histidine 358 in the carboxyl terminus of KCa3.1."
https://pharos.nih.gov/idg/targets/O15554,O15554,17151145,"KCa3.1 channels are a part of the signaling complex that forms at the IS upon antigen presentation."
https://pharos.nih.gov/idg/targets/O15554,O15554,16766578,"H441 cells express KCNN4 and cellular potassium conductance is important to the control of Na(+) absorption in respiratory epithelium"
https://pharos.nih.gov/idg/targets/O15554,O15554,16251351,"phosphatidylinositol 3-phosphate and these 14 amino acids regulate KCa3.1 channel activity by recruiting an as yet to be defined regulatory subunit that is required for Ca2+ gating of KCa3.1"
https://pharos.nih.gov/idg/targets/O15554,O15554,15965951,"Results describe the subcellular distribution of the canine (cIK1) and the human (hIK1) channel protein in different migrating cells."
https://pharos.nih.gov/idg/targets/O15554,O15554,15817638,"first demonstration that gating of the iKCa1 potassium channel is regulated by beta2-adrenoceptors"
https://pharos.nih.gov/idg/targets/O15554,O15554,15452196,"We present in this work a structural model of the open IKCa (KCa3.1) channel derived by homology modeling from the MthK channel structure, and used this model to compute the transmembrane potential profile along the channel pore."
https://pharos.nih.gov/idg/targets/O15554,O15554,15339840,"stochastic Ca2+ permeabilization rather than Gardos-channel variation is the main determinant selecting which sickle cells dehydrate through Gardos channels in each sickling episode"
https://pharos.nih.gov/idg/targets/O15554,O15554,15039018,"activation of Gardos channel at different oxygen tensions is correlated with changes in passive and active calcium transport and sensitivity to calcium"
https://pharos.nih.gov/idg/targets/O15554,O15554,14754884,"the NH(2) terminus of hIK1 contains overlapping leucine zipper and dileucine motifs essential for channel assembly and trafficking to the plasma membrane"
https://pharos.nih.gov/idg/targets/O15554,O15554,14724753,"K(Ca) channels presenting the pharmacology of SK4 channels are present on both apical and basolateral membranes, but it is the basolateral SK4-like channels that play a major role in calcium-dependent chloride secretion in 16HBE14o- cells."
https://pharos.nih.gov/idg/targets/O15554,O15554,12773623,"SK4 is the gene that codes for the Gardos channel in red blood cells. This channel is important pathophysiologically, because it represents the major pathway for cell shrinkage via KCl and water loss that occurs in sickle cell disease."
https://pharos.nih.gov/idg/targets/O15554,O15554,12612194,"Ca2+-activated Cl- secretion in native human airway epithelia requires activation of Ca2+-dependent basolateral K+ channels (hSK4)."
https://pharos.nih.gov/idg/targets/O15554,O15554,12609997,"arachidonic acid (AA) interacts with the pore-lining amino acids, Thr(250) and Val(275) in hIK1, conferring inhibition of hIK1 by AA"
https://pharos.nih.gov/idg/targets/O15554,O15554,12493744,"trafficking depends upon a C-terminal leucine zipper"
https://pharos.nih.gov/idg/targets/O15554,O15554,12421833,"functional role of the intermediate conductance Ca(2+)-activated K(+) channel, hIK1, in HaCaT keratinocytes"
https://pharos.nih.gov/idg/targets/O15554,O15554,10758170,"HIV-1 gp120 from both CCR5- and CXCR4-tropic HIV-1 strains opens calcium-activated potassium (K(Ca)), chloride, and calcium-permeant nonselective cation channels in macrophages; these signals are mediated by CCR5 and CXCR4"
https://pharos.nih.gov/idg/targets/P22459,P22459,22560931,"Expression of Kv1.4 appears to increase in the spinal cord of mice modelling remitting-relapsing experimental allergic encephalomyelitis (rrEAE) in peak and remitting phases."
https://pharos.nih.gov/idg/targets/P22459,P22459,21945024,"Detection of the methylation prevalence of KCNA4 and CYP26B1 together in serum demonstrated the good sensitivity and specificityin gastric cancer"
https://pharos.nih.gov/idg/targets/P22459,P22459,21307345,"Data suggest that episodic ataxia type 1 mutations affect fast inactivation of Kv1.1/1.4 channels by a reduction in either subunit surface expression or altered affinity for the inactivation domain."
https://pharos.nih.gov/idg/targets/P22459,P22459,19961828,"Sialylated N-glycans uniquely impact gating of a mammalian Shaker family K(v) channel isoform, K(v)1.5, but have no effect on gating of a second Shaker isoform, K(v)1.4."
https://pharos.nih.gov/idg/targets/P22459,P22459,19453640,"Both arachidonic acid and Trolox potently modulate Kv1.4 and Kv4.2 channel alpha-subunits, thereby presumably tuning presynaptic transmitter release and postsynaptic somatodendritic excitability in synaptic transmission and plasticity."
https://pharos.nih.gov/idg/targets/P22459,P22459,18640987,"Thr-330 of Kv1.4 serves to interlock the voltage-sensing and gating domains of adjacent monomers, thereby yielding a structure competent for the surface expression of functional tetramers"
https://pharos.nih.gov/idg/targets/P22459,P22459,17959711,"Ginsenoside Rg3 inhibits KV1.4 channel currents by interacting with the lysine531 residue."
https://pharos.nih.gov/idg/targets/P22459,P22459,17156368,"The results demonstrate that the human Kvbeta1.1 and Kvbeta1.2 subunits regulate the proportion of wild-type Kv1.4-1.1 channels that are available to open."
https://pharos.nih.gov/idg/targets/P22459,P22459,16308273,"Fast inactivation in human Kv1.4 is modulated by structural elements in the C-terminus, suggesting that the process involves the concerted action of the N- and C-termini."
https://pharos.nih.gov/idg/targets/P22459,P22459,15955806,"Novel role for GIP in regulating K(V)1.4 cell surface expression and modulation of A-type potassium currents"
https://pharos.nih.gov/idg/targets/P22459,P22459,15136567,"Results describe an erbstatin (Erb) analogue as a small molecule inhibitor of the N-type inactivation in potassium channels Kv1.4 and Kv1.1+Kvbeta1."
